,title,name,url,score,locked,created,num of comment,upvote ratio
0,Lifting the Premier League Trophy by 11pm 24/06/2020,t3_gx2gxw,https://i.redd.it/gwweoh42q2351.jpg,979,False,1591383846.0,123,0.98
1,Daily Discussion [2020-06-06],t3_gxmb4l,https://www.reddit.com/r/LiverpoolFC/comments/gxmb4l/daily_discussion_20200606/,6,False,1591456267.0,26,0.88
2,"Liverpool have no plans to make any summer signings. Timo Werner is not being considered by the club, nor is Ousmane Dembele. [BBC]",t3_gxkyrx,https://twitter.com/AnfieldEdition/status/1269059868163440640,249,False,1591449357.0,196,0.96
3,"Do you think Klopp goes for the points record, or will he rotate heavily when the title is clinched?",t3_gxm5jq,https://www.reddit.com/r/LiverpoolFC/comments/gxm5jq/do_you_think_klopp_goes_for_the_points_record_or/,32,False,1591455450.0,34,0.95
4,Ali with the fresh trim,t3_gx47gx,https://i.redd.it/25hijjaqb3351.jpg,775,False,1591391134.0,48,0.98
5,"Joyce- Liverpool passed up the chance to sign Werner as amid the uncertainty of the coronavirus pandemic, they did not want to commit almost £100 million in transfer fee and wages on a single player.",t3_gx84g0,https://www.thetimes.co.uk/article/regular-phone-calls-from-frank-lampard-lured-timo-werner-to-chelsea-cw2lz87fv,239,False,1591404360.0,149,0.93
6,What is your opinion about Brendan Rodgers now?,t3_gxmjyn,https://www.reddit.com/r/LiverpoolFC/comments/gxmjyn/what_is_your_opinion_about_brendan_rodgers_now/,15,False,1591457616.0,32,1.0
7,Possibility of wrapping up this season at the earliest,t3_gxldmf,https://www.reddit.com/r/LiverpoolFC/comments/gxldmf/possibility_of_wrapping_up_this_season_at_the/,19,False,1591451378.0,11,0.91
8,Liverpool's relegated women underfunded and in disarray,t3_gxd5na,https://www.theguardian.com/football/2020/jun/05/liverpools-relegated-women-underfunded-and-in-disarray?CMP=Share_iOSApp_Other,81,False,1591420183.0,22,0.87
9,1976-84 Liverpool named the 2nd greatest club side of all time by One Football,t3_gx9b9i,https://onefootball.com/en/news/onefootballs-greatest-ever-teams-in-2nd-place-is-30089607,128,False,1591408089.0,11,0.96
10,“Liverpool Women have been relegated from the WSL after the FA Board reached a majority decision to decide 2019/20 season on a PPG basis.”,t3_gx1tqe,https://twitter.com/jamespearcelfc/status/1268845200199254017?s=21,238,False,1591380621.0,146,0.95
11,You fellas having a meltdown because we wouldn't pay for one target whilst we're reigning European Champions and about to win the league for the first time in 30 years need to get a grip.,t3_gwrfyf,https://www.reddit.com/r/LiverpoolFC/comments/gwrfyf/you_fellas_having_a_meltdown_because_we_wouldnt/,2144,False,1591337317.0,535,0.91
12,Inside Training,t3_gx7ogs,https://streamable.com/px4vfz,62,False,1591402928.0,19,0.92
13,My 2nd attempt at a VVD poster.,t3_gx6swq,https://www.reddit.com/r/LiverpoolFC/comments/gx6swq/my_2nd_attempt_at_a_vvd_poster/,62,False,1591400071.0,11,0.89
14,[Belgian source VRT] Origi participating in trainers course.,t3_gx5guh,https://sporza.be/artikels/23-ex-rode-duivels-en-14-red-flames-volgen-trainerscursus~1591365530694/,70,False,1591395662.0,13,0.93
15,Relegated Transfer Targets,t3_gxa1iw,https://www.reddit.com/r/LiverpoolFC/comments/gxa1iw/relegated_transfer_targets/,26,False,1591410419.0,88,0.83
16,To all those now intent on attacking the owners (I'm looking at you net spend brigade),t3_gwzjcr,https://www.reddit.com/r/LiverpoolFC/comments/gwzjcr/to_all_those_now_intent_on_attacking_the_owners/,213,False,1591368739.0,196,0.82
17,This video sums up Bobby's on-ball play,t3_gwzotb,https://www.youtube.com/watch?v=t6RQKcQJ4Qc,162,False,1591369507.0,29,0.96
18,Georginio Wijnaldum - Ball Control - Liverpool,t3_gx50vm,https://www.youtube.com/watch?v=dId2nr29eyE,41,False,1591394151.0,14,0.9
19,OC. A meme I made a while back. I am a Full-time University student for context.,t3_gxnycg,https://i.imgur.com/J8A948N.jpg,1,False,1591464972.0,0,0.67
20,“Liverpool ‘closely monitoring’ Jadon Sancho transfer situation” - @migueldelaney,t3_gx2lef,https://www.independent.co.uk/sport/football/transfers/liverpool-transfer-news-jadon-sancho-manchester-united-real-madrid-a9550646.html,57,False,1591384427.0,125,0.67
21,"On this day 5 years ago, James Milner signed from Manchester City on a FREE transfer. One of the best and most underrated business deals we’ve done 🔴",t3_gwfh01,https://i.redd.it/sq611ol4nv251.jpg,4113,False,1591298110.0,198,0.97
22,So long Timo...,t3_gwm2jd,https://i.redd.it/pnqqene0jx251.jpg,937,False,1591320940.0,104,0.97
23,How Jurgen Klopp creates a winning culture,t3_gx4mo7,https://youtu.be/sxrl0FP8vno,25,False,1591392729.0,1,0.82
24,Don't worry everyone,t3_gwqnbp,https://i.imgur.com/KyDWMe4.png,296,False,1591334833.0,9,0.92
25,Chelsea closing in on the signing of Timo Werner. He won’t be joining #LFC,t3_gwmjxo,https://twitter.com/JamesPearceLFC/status/1268603312166842368?s=20,493,False,1591322416.0,490,0.94
26,"[Melissa Reddy] The priority has been to lock down Virgil van Dijk and Alisson for the long-term, while continuing to reward players that have delivered Champions League success and are close to ending a 30-year wait for the league title.",t3_gwnhpx,https://www.independent.co.uk/sport/football/transfers/timo-werner-chelsea-transfer-news-rb-leipzig-liverpool-latest-a9549676.html,423,False,1591325250.0,181,0.95
27,Our fixture list for first three round of matches revealed. Sunday 21st June - 7pm - v Everton :: Wednesday 24th June - 8:15pm - v Crystal Palace :: Thursday 2nd July - 8:15pm - v Man City,t3_gwwwdd,https://www.independent.co.uk/sport/football/premier-league/premier-league-fixture-list-season-dates-kick-off-times-latest-a9546486.html?utm_medium=Social&utm_source=Facebook&fbclid=IwAR2KVaHMv0HYbMFwsQOyweMGJds1wzcKLC76r5Ij9MEnkbQKLk7jHiENAso#Echobox=1591291062&gsc.tab=0,78,False,1591356717.0,22,0.95
28,"Timo Werner has made no secret of his desire to join #LFC, but the club cooled interest in April due to Covid-19. Chelsea have made their move, trebling his salary, offering more minutes and a core role in Frank Lampard's rebuild (Melissa Reddy)",t3_gwnibz,https://twitter.com/MelissaReddy_/status/1268614655678779395,254,False,1591325305.0,246,0.96
29,"Jurgen Klopp prefers on relying on the likes of Takumi Minamino, and Divock Origi rather than signing Werner. [ @LynchStandard ]",t3_gwn2dl,https://twitter.com/AnfieldEdition/status/1268609220049543172,232,False,1591323946.0,207,0.88
30,Daily Discussion [2020-06-05],t3_gwzt14,https://www.reddit.com/r/LiverpoolFC/comments/gwzt14/daily_discussion_20200605/,20,False,1591370087.0,432,0.78
31,"Pearce, May 20: Financial reality of COVID-19 for #LFC & impact on transfer plans - No matchday £ expected into 2021 - Media £ dropping due to TV rebates - Commercial £ hit by uncertainty over sponsors/retail - No lucrative friendlies/lower offers for fringe stars",t3_gwmwr2,https://twitter.com/JamesPearceLFC/status/1263087751509008385,154,False,1591323474.0,149,0.94
32,"Liverpool still haven’t started official talks with Leipzig for Werner, always asked for time. Only talks with the player (via Klöpp). Chelsea are ready with an official bid and if Liverpool will not match it on next hours, Werner will discuss his contract with Chelsea.",t3_gwle1h,https://twitter.com/fabrizioromano/status/1268587978999377920,182,False,1591318843.0,113,0.94
33,Timo Werner is ready to sign his contract as new Chelsea player until June 2025 on next days - paperworks time. Liverpool have not sent any official bid to hijack the move.,t3_gwo5wp,https://twitter.com/fabrizioromano/status/1268621993261268992?s=21,98,False,1591327280.0,133,0.93
34,"As we said @mirrorfootball weeks ago, always consistent stance from #LFC on Werner - release clause fee crazy in light of current financial crisis swamping football. Chelsea encouraged by that stance, and seemingly, owner unworried by huge Covid19-related losses...or FFP issues [Maddock]",t3_gwn6r7,https://twitter.com/maddockmirror/status/1268611089530380291?s=21,84,False,1591324324.0,93,0.87
35,Really going to miss New Balance and the blackout kits. This years one is next level 👌🏻,t3_gwashp,https://i.redd.it/n5d0an61ut251.jpg,876,False,1591276223.0,71,0.98
36,"Just been told that Liverpool have pulled out of the “Werner-deal”, because of “financial reasons”.",t3_gwm4qb,https://twitter.com/janaagefjortoft/status/1268597450186555393?s=21,73,False,1591321127.0,144,0.87
37,Breaking: Premier League shareholders meeting finished - five susbstites rule change approved #ProjectRestart @TheAthleticUK,t3_gwgrq1,https://twitter.com/david_ornstein/status/1268520071153975296?s=21,180,False,1591303554.0,26,0.99
38,So with the Werner transfer seemingly off the table - who do you want to see us realistically sign this upcoming transfer window?,t3_gwqay9,https://www.reddit.com/r/LiverpoolFC/comments/gwqay9/so_with_the_werner_transfer_seemingly_off_the/,40,False,1591333776.0,168,0.78
39,2 weeks till return of PL. This sub vs null & void brigade.,t3_gwf87b,https://v.redd.it/ujcstpsfjv251,195,False,1591297044.0,10,0.96
40,"LFC have been adamant for some time that they won’t be signing Timo Werner. Sometimes, these denials have to be taken with a pinch of salt - but apparently not in this case!",t3_gwlsaw,https://twitter.com/lynchstandard/status/1268593492407844870,55,False,1591320063.0,92,0.82
41,"Timo Werner has been offered a five year deal by Chelsea worth £200,000-a-week ahead of £50m...",t3_gwmbzb,https://twitter.com/johncrossmirror/status/1268591987265069056?s=20,45,False,1591321738.0,40,0.83
42,KO times (local) for the opening fixtures.,t3_gwkw0y,https://i.redd.it/5bgd1k908x251.jpg,53,False,1591317289.0,15,0.9
43,Merseyside derby that could decide title set for Sunday night TV slot on Sky’s freeview channel,t3_gwkiea,https://www.thetimes.co.uk/article/merseyside-derby-that-could-decide-title-set-for-sunday-night-tv-slot-on-sky-s-freeview-channel-vxkjcfsbm,55,False,1591316113.0,11,0.92
44,[David Lynch] Liverpool have not made loan offer for Barca’s Dembele,t3_gwh3d7,https://www.standard.co.uk/sport/football/liverpool-no-loan-offer-for-barcelona-ousmane-dembele-a4459521.html,99,False,1591304797.0,19,0.95
45,"Werner & Chelsea is getting hot! According to BILD information, Werner should sign a contract with Chelsea until 2025, collecting more than 10 million euros per year",t3_gwkjnb,https://twitter.com/cfbayern/status/1268577232932528128,52,False,1591316224.0,106,0.8
46,Chelsea’s contract bid for Werner has been sent to his agents - RB Leipzig have been warned too. That’s how Chelsea are showing to Werner and Leipzig their serious intention. Liverpool still haven’t made any official bid.,t3_gwm31i,https://twitter.com/fabrizioromano/status/1268597095524638722?,37,False,1591320984.0,34,0.79
47,Timo Werner has agreed to join Chelsea. More to follow.,t3_gwlnjo,https://twitter.com/matt_law_dt/status/1268591660650422272,41,False,1591319654.0,153,0.79
48,Thought on Gomez: Can he become a club legend?,t3_gwhw31,https://www.reddit.com/r/LiverpoolFC/comments/gwhw31/thought_on_gomez_can_he_become_a_club_legend/,50,False,1591307731.0,41,0.83
49,"It remains to be seen whether or not Liverpool make any move to try to hijack Chelsea’s bid, but Stamford Bridge insiders are confident of the deal going through.",t3_gwmd24,https://www.telegraph.co.uk/football/2020/06/04/timo-werner-agrees-join-chelsea/,23,False,1591321827.0,26,0.78
50,Jürgen Klopp told Liverpool players to wear masks and gloves when outside,t3_gwebr0,https://www.theguardian.com/football/2020/jun/02/jurgen-klopp-told-liverpool-players-wear-masks-gloves-premier-league-friendlies?CMP=Share_iOSApp_Other,103,False,1591292665.0,20,0.95
51,Youth centre back Remi Savage has signed his first professional contract with the club,t3_gwguqv,https://twitter.com/LFC/status/1268513015181316096,57,False,1591303890.0,12,0.95
52,When you are waiting for the EPL to return :/,t3_gvys5i,https://i.redd.it/182maupfhq251.png,1764,False,1591235691.0,33,0.99
53,Chelsea are looking to activate Timo Werner's release clause of €60m. Karlheinz Förster has been spotted in Leipzig with the Blues advancing. Big backing for Frank Lampard if they get it done.,t3_gwlkuy,https://twitter.com/nizaarkinsella/status/1268590182628024320,25,False,1591319423.0,21,0.79
54,Premier League statement on substitutes (5 per game now),t3_gwhgce,https://www.liverpoolfc.com/news/announcements/397879-premier-league-statement-june-4,40,False,1591306162.0,12,0.92
55,Nothing signed and sealed yet but told significant breakthrough with CFC and Werner this afternoon,t3_gwmbrx,https://twitter.com/sjohnsonsport/status/1268600361973157893,17,False,1591321718.0,0,0.7
56,Footballs duty in the wake of George Floyd’s death and my Liverpool future (Lovren Interview with skysports),t3_gwj5vu,https://www.skysports.com/football/news/11669/11999648/dejan-lovren-interview-footballs-duty-in-wake-of-george-floyds-death-and-my-liverpool-future,29,False,1591311871.0,16,0.84
57,"Timo Werner and his agents confirmed to Chelsea that they’re “ready” to consider and agree details for the contract offered until June 2025. If Liverpool will not hijack the move (and did nothing official yet with Leipzig and with Timo until now...), he’s going to accept #CFC. 🔵",t3_gwmrup,https://twitter.com/fabrizioromano/status/1268605984215379969?s=21,15,False,1591323059.0,39,0.6
58,Timo Werner: Chelsea favourites to sign RB Leipzig striker,t3_gwlf6b,https://www.skysports.com/share/12000636,16,False,1591318935.0,20,0.7
59,When do you think our next big transfer in will be?,t3_gwr1il,https://www.reddit.com/r/LiverpoolFC/comments/gwr1il/when_do_you_think_our_next_big_transfer_in_will_be/,3,False,1591336053.0,80,0.54
60,HSBC and StanChart back China security laws for HK - BBC News,t3_gwgjaw,https://www.bbc.com/news/business-52916119,27,False,1591302635.0,13,0.77
61,"Iconic Squad Numbers. When you think of a number, this player comes to mind...",t3_gwhg9v,https://www.reddit.com/r/LiverpoolFC/comments/gwhg9v/iconic_squad_numbers_when_you_think_of_a_number/,21,False,1591306155.0,32,0.8
62,2019-20 Premier league season so far,t3_gwkhn4,https://youtu.be/-ZLRV6kOBL4,6,False,1591316046.0,1,0.67
63,"Rafa's Boys, 2005",t3_gvsvau,https://i.redd.it/pkhcufv4to251.jpg,845,False,1591215412.0,16,0.99
64,Alisson on instagram,t3_gw3gww,https://i.redd.it/7sqi3ywvmr251.jpg,139,False,1591249601.0,28,0.98
65,"It makes sense, the youngsters can step up",t3_gx8zfb,https://www.liverpoolecho.co.uk/sport/football/football-news/timo-werner-sent-liverpool-message-18366786.amp,0,False,1591407046.0,48,0.17
66,Daily Discussion [2020-06-04],t3_gwcfep,https://www.reddit.com/r/LiverpoolFC/comments/gwcfep/daily_discussion_20200604/,24,False,1591283464.0,296,0.88
67,"Today, Liverpool Football Club is 128 years old!🎉",t3_gvo905,https://twitter.com/LFC/status/1268058079561564160,2177,False,1591193057.0,61,0.99
68,Kylian Mbappe told he could 'become a king' under Jurgen Klopp at Liverpool,t3_gvwiel,https://www.reddit.com/r/LiverpoolFC/comments/gvwiel/kylian_mbappe_told_he_could_become_a_king_under/,175,False,1591228524.0,71,0.93
69,Inside Training,t3_gvyrlt,https://streamable.com/7oeqkf,113,False,1591235644.0,19,0.96
70,"paul joyce on Twitter: ”1197 PL players and club staff tested for COVID-19 in latest round of tests. Of these, one has tested positive from one club.”",t3_gvvkc5,https://twitter.com/_pauljoyce/status/1268196349092208641?s=21,170,False,1591225408.0,31,0.98
71,John Houlding's recently created team officially became LIVERPOOL FOOTBALL CLUB on 3 June 1892. The name was officially recognised by the Board of Trade on this day.,t3_gvq9vf,https://i.redd.it/dmgfags5sn251.jpg,395,False,1591202950.0,14,0.99
72,"NEW: One positive test at Premier League club after 1,197 tests in fifth round",t3_gvvjip,https://twitter.com/skysports_bryan/status/1268195797952335872,77,False,1591225341.0,11,0.94
73,"Sky to defer PL rebate (over £170m) until 2021/22 season, easing cash flow for clubs & bigger transfer budgets this summer, TV want £107m back next month, If season curtailed,full £762m rebate stands & 25% drop in EFL solidarity",t3_gvx2yp,https://twitter.com/AdamCrafton_/status/1268209909637750784,55,False,1591230361.0,25,0.88
74,Potentiall cheap transfers this summer...,t3_gw0187,https://www.reddit.com/r/LiverpoolFC/comments/gw0187/potentiall_cheap_transfers_this_summer/,32,False,1591239245.0,49,0.78
75,"Liverpool have submitted a loan with option to buy proposal to Barcelona for French winger Ousmane Dembélé in recent days, but he has no intention of leaving, according to Gianluca Di Marzio.",t3_gvw6hk,https://twitter.com/gffn/status/1268160569795907586?s=21,50,False,1591227433.0,34,0.72
76,Tonight at 7 pm we'll be kickstarting the mother of all raffles. 500+ footballers. 500+ shirts. All proceeds go to @NHSCharities . #ShirtsForHeroes #PlayersTogether,t3_gvwmda,https://twitter.com/eBay_UK/status/1268135593273364480,47,False,1591228883.0,12,0.91
77,"Timo Werner: Liverpool, Chelsea and Manchester United have 12 days to buy forward for less than £50m",t3_gvojgk,https://www.skysports.com/football/news/11095/11999509/timo-werner-liverpool-chelsea-and-manchester-united-have-12-days-to-buy-forward-for-less-than-50m,110,False,1591194451.0,39,0.92
78,"1yr ago today I climbed a tree, scratched up my arms, and got this shot of the boys. Still my phone BG 365 days later!",t3_gv5do5,https://i.redd.it/nfayph59ch251.jpg,3959,False,1591125018.0,124,0.98
79,Neutral venue option assumes that football fans are inherently disorderly | Owen West,t3_gvs6kn,https://www.theguardian.com/football/blog/2020/jun/03/neutral-venue-option-assumes-that-football-fans-are-inherently-disorderly?CMP=Share_iOSApp_Other,42,False,1591212229.0,6,0.87
80,"""Maybe Liverpool are prioritising paying all their existing team & keeping all their staff employed & donating £ to Foodbanks & local causes rather than spaffing £50m on a release clause eh.""",t3_gwsco6,https://twitter.com/goobervision/status/1268637212121485320?s=19,0,False,1591340239.0,36,0.34
81,1 YEAR AGO🏆🏆🏆🏆🏆🏆,t3_gv1xhi,https://i.redd.it/1l7zkb9nwf251.jpg,2183,False,1591107602.0,36,0.99
82,Daily Discussion [2020-06-03],t3_gvp3tk,https://www.reddit.com/r/LiverpoolFC/comments/gvp3tk/daily_discussion_20200603/,19,False,1591197136.0,49,0.88
83,Inside Training,t3_gv6qxl,https://streamable.com/l2udit,303,False,1591131062.0,142,0.99
84,LFC Women will discover whether they will be relegated from the WSL by the end of this week. FA Board meeting on Thursday.,t3_gvfcof,https://twitter.com/JamesPearceLFC/status/1267918437969465344?s=19,72,False,1591159259.0,28,0.91
85,"James Norris (17, Full-back) has signed his first professional contract with the Reds",t3_gv85er,https://twitter.com/LFC/status/1267790012491468801,190,False,1591136316.0,27,0.98
86,Paul Joyce: Everton hopeful the Merseyside derby with Liverpool will be staged at Goodison Park. The club has now requested Liverpool City Council’s safety advisory group is convened and meeting likely to take place next week.,t3_gv6nec,https://twitter.com/_pauljoyce/status/1267772959797755904,148,False,1591130651.0,27,0.98
87,Virgil van Dijk and Georginio Wijnaldum were the driving force behind Liverpool's tribute to George Floyd at Anfield today. A powerful show of solitary from all 29 players who took a knee around the centre circle. #LFC,t3_guwlcj,https://twitter.com/JamesPearceLFC/status/1267497728604614657?s=19,982,False,1591085996.0,38,0.98
88,Unity is Strength. The Reds take a knee and say #BlackLivesMatter.,t3_guku94,https://i.redd.it/bkfs3txdya251.jpg,11709,False,1591047676.0,504,0.91
89,Manchester City ruined Daniel Aggers transfer to Barcelona in 2012,t3_gv4awz,https://www.reddit.com/r/LiverpoolFC/comments/gv4awz/manchester_city_ruined_daniel_aggers_transfer_to/,145,False,1591119747.0,42,0.97
90,Never fails to make me smile!,t3_gv4k79,https://i.redd.it/tnp8b3pm0h251.jpg,117,False,1591121048.0,2,0.95
91,Jurgen Klopp: Liverpool manager has 'missed football so much' - BBC Sport,t3_gv3ozp,https://www.bbc.co.uk/sport/football/52880996,125,False,1591116621.0,21,0.98
92,Throwback to this discussion about Alisson's quality,t3_gv642m,https://www.reddit.com/r/liverpoolfc/comments/8oulq7/_/,44,False,1591128382.0,58,0.83
93,Liverpool's projected squad (w/o signings) for 20/21 season,t3_gv5a1i,https://www.reddit.com/r/LiverpoolFC/comments/gv5a1i/liverpools_projected_squad_wo_signings_for_2021/,40,False,1591124541.0,31,0.88
94,"Liverpool submitted a loan with option to buy proposal to Barcelona for French winger Ousmane Dembélé in recent days, but he has no intention of leaving. [Gianluca Di Marzio]",t3_gvtaa5,https://gianlucadimarzio.com/it/calciomercato-dembele-futuro,0,False,1591217146.0,39,0.44
95,This time last year. One of the most emotional moments from the final.,t3_gut1g2,https://youtu.be/ONM-0QSpWTs,157,False,1591074349.0,15,0.98
96,Daily Discussion [2020-06-02],t3_gv2kmc,https://www.reddit.com/r/LiverpoolFC/comments/gv2kmc/daily_discussion_20200602/,21,False,1591110693.0,57,0.84
97,"Interesting XIs from first LFC 'training game' at Anfield, Gini sat out, Shaq not there home: Alisson; Hoever, Matip, VVD, Robbo; Jones, Hendo, Keita; Elliott, Firmino, Mane away: Adrian; Trent, Lovren, Gomez, Larouci; Ox, Fabinho, Milner; Salah, Minamino, Origi",t3_guqjhl,https://twitter.com/maddockmirror/status/1267530263711698945,157,False,1591066660.0,56,0.98
98,Just came across this video again. I feel a duty to post so others can do the same.,t3_gumjtz,https://v.redd.it/eiygzwj0gb251,288,False,1591053879.0,22,0.98
99,I can imagine Alisson assisting Timo like that. (Timo Werner Goal against FC Köln),t3_gurkvd,https://streamja.com/7angr,128,False,1591069812.0,56,0.93
100,On This Day... | Free Podcast (TAW),t3_gv0g2y,https://youtu.be/DuYMY3eEO5I,27,False,1591100809.0,0,0.86
101,Wide shot of team scrimmage at Anfield today (6/1),t3_gup6yv,https://i.redd.it/cqxhjwz96c251.png,142,False,1591062484.0,32,0.93
102,Is anyone else kind of unenthused at the idea of being crowned champions?,t3_gvv9sk,https://www.reddit.com/r/LiverpoolFC/comments/gvv9sk/is_anyone_else_kind_of_unenthused_at_the_idea_of/,0,False,1591224439.0,39,0.27
103,Liverpool agree to let Harry Wilson extend Bournemouth loan deal into July,t3_gunwxz,https://www.thetimes.co.uk/article/liverpool-agree-to-let-harry-wilson-extend-bournemouth-loan-deal-into-july-lz7bf3c96,136,False,1591058438.0,13,0.99
104,"This day one year ago, Liverpool won the UEFA Champions League for the 6th time. What a moment that was",t3_gu8yl2,https://i.redd.it/r8gekt79l6251.jpg,3370,False,1590994817.0,113,0.98
105,ESPNFC trolls Steve Nicol about the reds still being the best in Europe,t3_gv09a7,https://youtu.be/0JlOfLLB7Vo,13,False,1591100001.0,3,0.69
106,Probably my favourite clip from the final. Origi x Runaway,t3_guhhp1,https://v.redd.it/i3sbvpupo9251,266,False,1591032572.0,36,0.98
107,Digital Sketch; One year ago today 🏆 [OC],t3_gulpxi,https://i.redd.it/t7vj47u48b251.jpg,92,False,1591050931.0,8,0.93
108,Bobby with the '79 LFC Retro kit,t3_gu6gz8,https://i.redd.it/6hvwnbgmv5251.jpg,2236,False,1590986198.0,129,0.99
109,Andrew Robertson exclusive: Liverpool's Virgil van Dijk and Jurgen Klopp are best in the world,t3_gun96l,https://www.skysports.com/amp/football/news/11669/11997014/andrew-robertson-exclusive-liverpools-virgil-van-dijk-and-jurgen-klopp-are-best-in-the-world,61,False,1591056275.0,3,0.92
110,"Concert Square, Liverpool, one year ago today",t3_gugw99,https://streamable.com/gituvz,204,False,1591029453.0,11,0.99
111,Liverpool FC update on kit supplier,t3_gulkng,https://www.liverpoolfc.com/news/announcements/397568-liverpool-fc-update-on-kit-supplier,63,False,1591050401.0,13,0.94
112,"Is there now a ""Coutinho Fear Factor"" for players when considering a move away from Liverpool",t3_gulqve,https://www.reddit.com/r/LiverpoolFC/comments/gulqve/is_there_now_a_coutinho_fear_factor_for_players/,65,False,1591051031.0,39,0.85
113,Harvey Elliott (16) right after he dribbled past the Shrewsbury captain [1920x1080],t3_guguf4,https://i.imgur.com/gw4lNpA.jpg,112,False,1591029180.0,5,0.98
114,New Liverpool Training Session and The Madrid Final Anniversary,t3_guk26c,https://youtu.be/R0nT78EGspw,26,False,1591044562.0,3,0.87
115,Klopp vs Guardiola | Pyramid vs W-W | Difference between Liverpool & Man City's 4-3-3 system,t3_gukfuz,https://www.youtube.com/watch?v=F6fLeqJ5Qq8,23,False,1591046103.0,0,0.93
116,Liverpool's CL final win opened my eyes to a totally different way of life,t3_gugsz5,https://www.liverpool.com/liverpool-fc-news/features/liverpool-tottenham-champions-league-final-18300904?utm_source=linkCopy&utm_medium=social&utm_campaign=sharebar,52,False,1591028970.0,6,0.85
117,Who said these Andy Robertson quotes? | The Football Show,t3_guiv1g,https://youtu.be/wIbB_tPlvyQ,29,False,1591039337.0,3,0.88
118,"Real Madrid rolled out the red carpet to try to convince Harvey Elliott to sign for them. There was a tour of the Bernabeu & he was asked if he wanted to meet Sergio Ramos. He replied: ""No, it’s OK thanks. I don’t like him after what he did to Mo Salah.” - James Pearce",t3_gtv7k6,https://twitter.com/JamesPearceLFC/status/1267005432972947456?s=19,4126,False,1590941736.0,287,0.95
119,Jurgen Klopp Exclusive Interview: 24 Hours In Madrid - The Anfield Wrap,t3_guiwju,https://www.youtube.com/watch?v=H3OOd4SqX3c,23,False,1591039531.0,2,0.86
120,Harvey Elliott along with his family in Kiev supporting the Reds. (Source: The Athletic),t3_gu1yea,https://i.redd.it/9n0smi9fm4251.png,641,False,1590970989.0,35,0.99
121,Daily Discussion [2020-06-01],t3_gugyqo,https://www.reddit.com/r/LiverpoolFC/comments/gugyqo/daily_discussion_20200601/,25,False,1591029817.0,130,0.82
122,So disappointed in us,t3_gtz81r,https://i.redd.it/35mdxrwkt3251.png,615,False,1590961323.0,15,0.98
