,title,name,url,score,locked,created,num of comment,upvote ratio
249,Istanbul victory celebrations in the streets of Liverpool — the night of the win and the victory parade the next day. Featuring interviews with fans and players on the bus.,t3_gqrcmi,https://v.redd.it/3bu86tt5t1151,737,False,1590501357.0,22,0.99
250,Crouchy hosts Stevie for a few questions,t3_gqz525,https://youtu.be/aAo3sUKi2rc,96,False,1590535698.0,17,0.96
251,"Loris Karius has held talks with Hertha Berlin’s goalkeeping coach over a possible transfer, per Sky Sport reporter Marc Behrenbeck",t3_gqyx73,https://lfcglobe.co.uk/journalist-confirms-club-interested-in-liverpool-outcast-with-initial-talks-already-held/,66,False,1590534997.0,12,0.91
252,Trent Alexander Arnold's Best Passes - 2019/20,t3_gqwtzn,https://www.youtube.com/watch?v=VAebAfcnSd4,91,False,1590527672.0,8,0.98
253,"Official store getting rid of the last New Balance stock, free global delivery.",t3_gqxity,https://store.liverpoolfc.com/last-chance/kit,75,False,1590530202.0,22,0.95
254,"Football Daily on BBC Radio 1- Jordan Henderson on feeling safe, fitness and waiting for the title",t3_gr5789,https://www.bbc.co.uk/sounds/play/p08f7fxf,18,False,1590554489.0,2,0.81
255,Mo makes it look easy. What a goal.,t3_gqcncg,https://v.redd.it/5zi9d4h2gx051,2703,False,1590448302.0,140,0.99
256,Champions of Europe 2005 - Legendary Moments,t3_gr03wo,https://www.youtube.com/watch?v=4YiRrLueFW8,23,False,1590538774.0,2,0.9
257,The miracle that inspired a whole generation and more (credit to B/R),t3_gqd3rc,https://i.redd.it/71w3hg6okx051.jpg,1807,False,1590449806.0,22,0.98
258,Liverpool FC update on matchday ticket refunds,t3_gqtiv1,https://www.liverpoolfc.com/news/tickets/396564-liverpool-fc-update-on-matchday-ticket-refunds,62,False,1590512552.0,21,0.94
259,"OTD in 2005, Istanbul.",t3_gqdwxa,https://i.redd.it/4xnfnx8gsx051.jpg,1253,False,1590452420.0,28,0.99
260,Hendo's response to Michael Ballack's comments on Virgil,t3_gq7342,https://i.redd.it/wpdlbbvucv051.jpg,1722,False,1590423078.0,174,0.98
261,Daily Discussion [2020-05-26],t3_gqs99g,https://www.reddit.com/r/LiverpoolFC/comments/gqs99g/daily_discussion_20200526/,25,False,1590505897.0,65,0.88
262,Inside Training,t3_gqia5j,https://streamable.com/pnb55b,95,False,1590466123.0,12,0.97
263,Would you take Joe Hart as a backup keeper for next year?,t3_grkdaf,https://www.reddit.com/r/LiverpoolFC/comments/grkdaf/would_you_take_joe_hart_as_a_backup_keeper_for/,0,False,1590617242.0,23,0.21
264,[EU/PC] FIFA 20 Custom Teams Tournament,t3_gr0ka7,https://www.reddit.com/r/LiverpoolFC/comments/gr0ka7/eupc_fifa_20_custom_teams_tournament/,3,False,1590540184.0,1,0.64
265,"Meanwhile, a bit higher up. JC: “Milan lead 3-0 at halftime, this is DONE!” G: “We’ll see...”",t3_gqe02s,https://i.redd.it/hgkki1x8tx051.jpg,169,False,1590452686.0,13,0.94
266,Sport Bild has confirmed that Jürgen Klopp held a virtual meeting with RB Leipzig's Timo Werner at Easter. #LFC,t3_gqa76j,https://twitter.com/swearimnotpaul/status/1264892566224474117,329,False,1590438824.0,29,0.98
267,"The Football Show | John Barnes | Early life, Liverpool success and racism in football",t3_gqpun9,https://youtu.be/Ld_QrIRIqx4,17,False,1590494424.0,5,0.85
268,Happy Anniversary Everyone!,t3_gqdelj,https://i.imgur.com/n89nEx9.jpg,130,False,1590450811.0,8,0.97
269,"This Game Developers Conference talk focuses on Jurgen Klopp as a real-life example of the effectiveness of Self-Determination Theory in managing teams. I'd say it represents why players want to play for him, and why fans love him as cultural core of the current team.",t3_gqgggr,https://www.youtube.com/watch?v=ajzYQpOwfL0,76,False,1590460501.0,17,0.96
270,how times have changed,t3_gpyxji,https://i.redd.it/dgqdx7yais051.jpg,2087,False,1590388471.0,62,0.99
271,David Ornstein in response to the Klopp and Werner video call information: “They also spoke before lockdown”,t3_gqapdd,https://twitter.com/david_ornstein/status/1264877335016333312,138,False,1590441045.0,16,0.98
272,Mainz 05 on Twitter,t3_gpwxxd,https://i.redd.it/7zfra0hlxr051.jpg,2757,False,1590381508.0,89,0.99
273,LFC to show full match replay of 2005 final for free from 19:45 BST,t3_gqb6b1,https://twitter.com/LFC/status/1264888951283650563,111,False,1590442992.0,19,0.97
274,Do you prefer Redmen TV or The Anfield Wrap? And why?,t3_gqg2hu,https://www.reddit.com/r/LiverpoolFC/comments/gqg2hu/do_you_prefer_redmen_tv_or_the_anfield_wrap_and/,43,False,1590459310.0,42,0.96
275,Drawing Mo,t3_gqclys,https://i.redd.it/wr24nmzufx051.jpg,72,False,1590448185.0,3,0.95
276,How will the Nike deal come into effect June 1st?,t3_gqmrr0,https://www.reddit.com/r/LiverpoolFC/comments/gqmrr0/how_will_the_nike_deal_come_into_effect_june_1st/,10,False,1590481947.0,18,0.67
277,Jan Aage Fjortoft and Christian Falk confirm there was a virtual meeting between Klopp and Werner at Easter.,t3_gqa6nc,https://twitter.com/janaagefjortoft/status/1264877236605370369?s=21,73,False,1590438759.0,15,0.89
278,"We're proud to join the football community, @ICMEC_official and @ECAEurope to make sure #NoChildStandsAlone ❤️ #InternationalMissingChildrensDay",t3_gqfzz8,https://twitter.com/lfc/status/1264980864527671297?s=21,23,False,1590459093.0,0,0.93
279,I know today has been celebrated to death and here's a video to further encapsulate that night in Istanbul,t3_gqcsat,https://vimeo.com/24225186,31,False,1590448755.0,6,0.93
280,43 years ago today Liverpool were crowned kings of Europe for the first time,t3_gq7mjr,https://youtu.be/NL3-DOQOAN0,101,False,1590425869.0,8,0.97
281,"Happy Istanbul Day, Reds!",t3_gq8aoz,https://www.reddit.com/r/LiverpoolFC/comments/gq8aoz/happy_istanbul_day_reds/,79,False,1590429362.0,3,0.95
282,"Remade Klopps “this means more” speech in Fifa 20, enjoy!",t3_gqcihz,https://youtu.be/0NFd45M_iQ4,30,False,1590447867.0,2,0.84
283,Jerzy Dudek's save in 119th minute,t3_gq33oh,https://streamable.com/2kytq,249,False,1590404261.0,32,0.99
284,"From 'dust' to glory, Liverpool's 'miracle' of Istanbul",t3_gq9k8c,https://www.nst.com.my/sports/football/2020/05/595245/dust-glory-liverpools-miracle-istanbul,43,False,1590435800.0,2,0.92
285,The Road to Istanbul: Bayer Leverkusen 1-3 Liverpool 2005,t3_gqjiup,https://www.holdingmidfield.com/the-road-to-istanbul-bayer-leverkusen-1-3-liverpool-2005-tactics-tactical-analysis/,8,False,1590470164.0,7,0.7
286,"Happy memories from Istanbul on this day 15 years ago, one of the best days of our lives.",t3_gq1os8,https://i.redd.it/aeity9tict051.jpg,239,False,1590398684.0,6,0.99
287,Does anyone else hate the online version of The Echo?,t3_gq98g5,https://www.reddit.com/r/LiverpoolFC/comments/gq98g5/does_anyone_else_hate_the_online_version_of_the/,38,False,1590434168.0,19,0.89
288,Just realised Liverpool's famous 1996 clash with Newcastle is on youtube and it's the full match!! Are there any other gems on there that you know of?,t3_gqb0am,https://youtu.be/wyF6QDcDVfE,23,False,1590442297.0,7,0.84
289,FA statement: Women's Super League season ended,t3_gqbjbg,https://www.liverpoolfc.com/news/women/396878-fa-statement-women-s-super-league-season-ended,19,False,1590444441.0,11,0.81
290,"On this day 15 years ago, Liverpool completed the greatest comeback of all time, going onto beat AC Milan 3-2 on penalties....",t3_gpzd38,https://www.youtube.com/watch?v=PWErN627Il8,292,False,1590390002.0,32,0.99
291,LFC Instagram: The boss when he realises it’s Istanbul 2005 anniversary...,t3_gq8t27,https://www.instagram.com/p/CAm34Zil_Eh/,28,False,1590431920.0,4,0.87
292,Liverpool beat AC Milan: Memories of the 'Miracle of Istanbul' by those who were there,t3_gq7exs,https://www.bbc.com/sport/football/52771492,34,False,1590424754.0,5,0.91
293,In honor of the Miracle of Istanbul- here’s 15 Minutes That Shook the World (full movie),t3_gq8n7r,https://youtu.be/WEbaA9dhIQs,19,False,1590431090.0,3,0.83
294,[Werner Watch] Timo has scored a hat-trick this afternoon vs Mainz...,t3_gpr64l,https://www.reddit.com/r/LiverpoolFC/comments/gpr64l/werner_watch_timo_has_scored_a_hattrick_this/,563,False,1590361580.0,112,0.97
295,No caption needed,t3_gpwa3a,https://i.redd.it/1nqzosavqr051.jpg,192,False,1590379245.0,16,0.97
296,What do you guys think about my new wallpaper?,t3_gpz6y4,https://v.redd.it/sgsdxufyks051,116,False,1590389390.0,11,0.95
297,"""NHS data suggests the Liverpool-Atleti game on 11th March led to 41 deaths""",t3_gpuweh,https://twitter.com/JamesMills1984/status/1264526684939792384?s=19,229,False,1590374513.0,94,0.95
298,Daily Discussion [2020-05-25],t3_gq6g6z,https://www.reddit.com/r/LiverpoolFC/comments/gq6g6z/daily_discussion_20200525/,22,False,1590419818.0,91,0.92
299,Happy Birthday Vladimir Smicer!,t3_gpp67f,https://www.reddit.com/r/LiverpoolFC/comments/gpp67f/happy_birthday_vladimir_smicer/,376,False,1590353390.0,31,1.0
300,'The best moment of my life' - Liverpool's Miracle in Istanbul,t3_gpze3c,https://www.goal.com/en-gb/news/the-best-moment-of-my-life-liverpools-miracle-in-istanbul/sk3rrp4tv5ve1iqzolics4mc2,36,False,1590390099.0,3,0.87
301,Damn straight he did Crouchy Lad,t3_gpgu93,https://i.redd.it/0wvimaei7m051.jpg,1452,False,1590312201.0,28,0.99
302,The Road to Istanbul: Liverpool 3-1 Bayer Leverkusen 2005,t3_gpvrtp,https://www.holdingmidfield.com/the-road-to-istanbul-liverpool-3-1-bayer-leverkusen-2005-tactics-tactical-analysis/,28,False,1590377514.0,0,0.94
303,Liverpool F.C edit (Not Mine) found on twitter.,t3_gpmw9r,https://v.redd.it/bcou0nbeno051,151,False,1590341834.0,16,0.95
304,Jürgen Klopp reads the story of 'King Kenny' | Presented by Standard Chartered,t3_gpmlov,https://youtu.be/k8ObDz3S85k,151,False,1590340195.0,9,0.97
305,Who signed this? TIA,t3_gpqg7z,https://i.redd.it/v3r8m0tj2q051.jpg,57,False,1590358960.0,15,0.93
306,Inside Training,t3_gpp2sf,https://streamable.com/6sleek,67,False,1590352947.0,10,0.92
307,Imagining Trent on the cross... [Werner Watch],t3_gpq2av,https://streamja.com/0PO4n,47,False,1590357388.0,18,0.84
308,I can't help but wear my 90/91 Candy Shirt and it's starting to peel just a little bit. Anyone got a good tip on how to stop it getting any worse? Maybe some kind of glue?,t3_gppodf,https://i.redd.it/1q6buulssp051.jpg,45,False,1590355679.0,38,0.9
309,Love the mane memes ❤,t3_gp3o2y,https://i.redd.it/cpuh169g7i051.jpg,5071,False,1590263753.0,62,0.98
310,Highlights Of Liverpool Latest Training Session,t3_gpyf6z,https://www.youtube.com/watch?v=9D5k8qlWqyo&feature=share,8,False,1590386675.0,1,0.67
311,Sadio Mane: a brief look into imbalance,t3_gpls8q,https://www.reddit.com/r/LiverpoolFC/comments/gpls8q/sadio_mane_a_brief_look_into_imbalance/,103,False,1590335566.0,16,0.98
312,Social distancing - The LFC way🥇,t3_gpdahf,https://i.redd.it/w9qmhtea4l051.jpg,552,False,1590299010.0,24,0.96
313,Virgil Van Dijk Poster,t3_gppmnj,https://www.reddit.com/r/LiverpoolFC/comments/gppmnj/virgil_van_dijk_poster/,28,False,1590355452.0,1,0.84
314,All PL goals from our 07/08 season,t3_gpo7uw,https://youtu.be/69ep2OoIR5A,41,False,1590348847.0,13,0.92
315,"Blog Update: A Wedding, A Football Game & A Pandemic",t3_gq84kx,https://www.reddit.com/r/LiverpoolFC/comments/gq84kx/blog_update_a_wedding_a_football_game_a_pandemic/,0,False,1590428465.0,1,0.47
316,You'll Never Walk Alone (Human Interest Documentary) | Real Stories,t3_gpn5yt,https://youtu.be/PjriA6oDjdw,18,False,1590343334.0,1,0.82
317,Daily Discussion [2020-05-24],t3_gplccj,https://www.reddit.com/r/LiverpoolFC/comments/gplccj/daily_discussion_20200524/,22,False,1590333147.0,73,0.88
318,Curved as you like,t3_gp5qiw,https://v.redd.it/mwlehoelxi051,394,False,1590272571.0,23,0.99
319,"Happy Birthday, Joe Gomez! 🎉",t3_gp099t,https://twitter.com/LFC/status/1264081627853946880?s=19,857,False,1590244552.0,44,0.99
320,"[Neil Jones] Liverpool expect Karius to move on this summer, and a return to Germany is looking like a possibility",t3_gp7wq6,https://www.goal.com/en/news/liverpool-karius-wanted-hertha-berlin/f92nxs3xmkkg1rd0nqskntnw0,125,False,1590280423.0,33,0.98
321,How Nike Signed Liverpool FC,t3_gpctib,https://youtu.be/FNHuPeacJ9c,46,False,1590297366.0,21,0.84
322,"Happy Birthday to Pedro Chirivella, also 23 today!",t3_gp23ej,https://i.redd.it/wsxi90zshh051.jpg,365,False,1590255128.0,15,0.99
323,BBC are reliving the 2006 FA Cup final between Liverpool and West Ham,t3_gp7hla,https://www.bbc.com/sport/live/football/52726943,68,False,1590278905.0,41,0.97
324,Steven Gerrard vs Germany 2001 (credit GDCOMPS),t3_gp719o,https://twitter.com/lfcgdon/status/1263560701664256003?s=21,63,False,1590277288.0,9,0.94
325,"I was bored... So, I made this. Just a little quarantine entertainment for you.",t3_gp0r7k,https://i.redd.it/1xke5f4wtg051.gif,290,False,1590247287.0,17,0.93
326,Lonergan interview - 'Working with Alisson Becker is a joy - he is the best',t3_gp526u,https://www.liverpoolfc.com/news/first-team/396602-alisson-becker-andy-lonergan-liverpool-best-goalkeeper,90,False,1590269900.0,6,0.97
327,Hendo interview with Sky Sports- 'Does Jordan Henderson think the break will affect Liverpool's winning mentality?',t3_gp7aq4,https://www.youtube.com/watch?v=dx-l6MlErrs,40,False,1590278244.0,4,0.94
328,Poch names his top three Prem players,t3_gp7dh0,https://www.skysports.com/watch/video/sports/football/11993073/poch-names-his-top-three-prem-players,34,False,1590278506.0,11,0.88
329,Pepe Reina supporting a far-right demonstration across Spain.,t3_gp6hsx,https://twitter.com/PReina25/status/1264183463500034049?s=19,31,False,1590275356.0,129,0.68
330,Klopp on Liverpool returning to training and Gary neville,t3_gp2hgy,https://v.redd.it/xnb086peoh051,52,False,1590257397.0,3,0.95
331,What a picture!,t3_goo647,https://i.redd.it/k137vsiztc051.png,790,False,1590198693.0,70,0.98
332,Bend it like Trent,t3_goh0k1,https://v.redd.it/owgkob04pa051,3128,False,1590172870.0,96,0.98
333,Aged like milk,t3_gojqfn,https://i.redd.it/cucnx0kcnb051.jpg,1018,False,1590184351.0,72,0.99
334,"[Christian Falk] I think the transfer is happening (of Werner to Liverpool). Interestingly, Timo Werner now has a new Social Media & Marketing agency. The boss of this agency is also Jürgen Klopp’s manager. Werner is also talking a lot about Liverpool in the public.",t3_gonp04,https://lfctransferroom.com/exclusive-interview-w-christian-falk-bilds-head-of-football/,344,False,1590197329.0,69,0.98
335,Daily Discussion [2020-05-23],t3_gp0n7z,https://www.reddit.com/r/LiverpoolFC/comments/gp0n7z/daily_discussion_20200523/,22,False,1590246681.0,47,0.88
336,Liverpool Training Session (Highlights Of Day 3 Return To Training),t3_goz1ip,https://youtu.be/AATWnfoJNpg,32,False,1590238326.0,1,0.88
337,Jurgen in quiz with German kid,t3_gow8cq,https://youtu.be/WdiQYuJS1Qs,33,False,1590226349.0,7,0.89
338,Liverpool vs Roma highlight in champions league in 2018,t3_gol802,https://v.redd.it/6mgerlvy1c051,221,False,1590189459.0,38,0.99
339,Marco Grujic is playing against Union Berlin right now.,t3_gop193,https://www.reddit.com/r/LiverpoolFC/comments/gop193/marco_grujic_is_playing_against_union_berlin/,70,False,1590201308.0,22,0.92
340,"Adrian on the Atletico loss: “The man of the match was definitely Oblak and, in the end, Atletico played their game, they beat us in both games and they should have progressed because they deserved it.""",t3_gony1i,https://www.goal.com/en/amp/news/adrian-oblak-atletico-madrid-beat-liverpool-champions-league/m9mncvz1m2mg1j5aqj86kod7t,64,False,1590198044.0,95,0.76
341,Inside Training,t3_golztb,https://streamable.com/kcoyj5,63,False,1590192024.0,6,0.94
342,Neville and Carragher react to HILARIOUS football impressions with Darren Farley!,t3_golu7z,https://youtu.be/Ll1NmgUe408,47,False,1590191526.0,8,0.83
343,Ox looking sharp,t3_gog8zv,https://twitter.com/LFC/status/1263428886731411456,137,False,1590169025.0,18,0.98
344,If the club never lost a final/never finished runners up. Updated with actual trophy total and loses. [OC],t3_goig85,https://i.redd.it/5uv23syg8b051.jpg,76,False,1590179348.0,49,0.79
345,Unforgettable: The story of the incredible 2018/19 Champions League (Really good free documentary from BT Sport on Youtube),t3_gohiuc,https://www.youtube.com/watch?v=ryWM9gGQfw4,82,False,1590175212.0,28,0.94
346,Mourinho on how important ball Boys are and trents quick corner,t3_go606h,https://v.redd.it/ry60qt1ou6051,936,False,1590126282.0,72,0.99
347,When Liverpool FC gives 5 years to Jurgen Klopp,t3_gonrti,https://www.youtube.com/watch?v=xcJGnUEk-Mk,23,False,1590197548.0,0,0.85
348,"One-way systems, physios in hazmat suits and dubious hairstyles: Inside Liverpool's first week back",t3_gojxjd,https://www.telegraph.co.uk/football/2020/05/22/one-way-systems-physios-hazmat-suits-dubious-hairstyles-inside/,42,False,1590185058.0,2,0.94
349,Head of Nutrition Mona Nemmer talks about detailed player preparation,t3_gogcsw,https://twitter.com/LFC/status/1263758498631909379,69,False,1590169579.0,4,0.95
350,Greatness recognises the Greatest.,t3_gomudh,https://www.bbc.co.uk/sport/av/football/52764747,12,False,1590194729.0,23,0.73
351,Liverpool reduced Mauricio Pochettino to tears after Champions League final defeat of Tottenham Hotspur,t3_gotqyf,https://www.liverpoolecho.co.uk/sport/football/football-news/liverpool-reduced-mauricio-pochettino-tears-18300048.amp,6,False,1590216938.0,21,0.54
352,Expectation vs Reality,t3_gnv3su,https://i.redd.it/sdez04rzr3051.jpg,2332,False,1590089169.0,124,0.97
353,"""If you look at England or the German third division, you get the sense that clubs suddenly detect moral concerns [about continuing the season], depending on their position in the table."" - Bundesliga CEO Christian Seifert",t3_go413k,https://twitter.com/honigstein/status/1263539513235832841?s=19,379,False,1590119965.0,60,0.99
354,Throwback to when Alisson showed he's not just good with his hands,t3_gnz9a4,https://v.redd.it/wjrw7kbk25051,739,False,1590104806.0,60,0.99
355,Daily Discussion [2020-05-22],t3_goelwr,https://www.reddit.com/r/LiverpoolFC/comments/goelwr/daily_discussion_20200522/,24,False,1590160467.0,42,0.87
356,Look how ripped our boy Lallana is looking ready to go,t3_gnweeq,https://i.redd.it/t5xkj5xj84051.jpg,631,False,1590094782.0,54,0.99
357,Free Talk Friday [22-05-2020],t3_godjj2,https://www.reddit.com/r/LiverpoolFC/comments/godjj2/free_talk_friday_22052020/,28,False,1590155060.0,34,0.95
358,Liverpool Players Back To Training At Melwood (Highlights of Day 2),t3_go83p4,https://youtu.be/NnjK3tBqYD4,41,False,1590133307.0,2,0.87
359,Boom! The boss Jurgen Klopp oil painting by me.,t3_gnwrmc,https://i.redd.it/zp3k0qd7d4051.jpg,272,False,1590096193.0,12,0.97
360,"Jürgen Klopp: on clothes, the keys to coaching and Liverpool team talks | Jacob Steinberg",t3_go9xki,https://www.theguardian.com/football/2020/may/21/jurgen-klopp-liverpool-clothes-keys-to-coaching-team-talks-kick-it-out?CMP=Share_iOSApp_Other,31,False,1590139860.0,1,0.9
361,Mo and his daughter. 💓,t3_gnr1tl,https://v.redd.it/fwlkmatk12051,878,False,1590068154.0,57,0.99
362,Liverpool agree Nike financial settlement to move start date for new kit deal,t3_gnwjlk,https://www.mirror.co.uk/sport/football/news/liverpool-agree-nike-financial-settlement-22061461,132,False,1590095313.0,37,0.97
363,"#OnThisDay in 2017, Liverpool qualified for the Champions League by beating Middlesborough 3-0... Set up some big nights in Europe the following season...🔥",t3_gnurld,https://twitter.com/theanfieldwrap/status/1263388558322282498?s=21,186,False,1590087584.0,36,0.97
364,Official Face Covering Range Launched,t3_go5e77,https://store.liverpoolfc.com/liverpool-fc-face-coverings?wgu=7413_198929_15900954205967_dce40224ef&wgexpiry=1745615420&source=webgains&siteid=198929&utm_source=affiliates&utm_medium=webgains&utm_campaign=198929,27,False,1590124268.0,28,0.8
365,Jurgen Klopp jokes about Gary Neville having an opinion on everything & discusses 'Project Restart',t3_go19wc,https://www.youtube.com/watch?v=2DaaKEztduw,45,False,1590111242.0,7,0.93
366,Bobby coming back straight out of the 80s,t3_gngjp7,https://i.redd.it/12td2ii7nyz41.jpg,3072,False,1590027105.0,185,0.99
367,Chelsea FC's Billy Gilmour sometimes wears Robertson's LFC jersey at home,t3_gnv66w,https://www.chelseafc.com/en/news/2020/05/02/billy-gilmour-on-childhood-chelsea-kits--scottish-sitcoms-and-re,115,False,1590089471.0,14,0.96
368,"Pep Lijnders returns with another new skill for you all to learn in 'Home Skills' Ep.3, presented by @AXA",t3_go1cbt,https://twitter.com/LFC/status/1263522946578092036,29,False,1590111459.0,0,0.92
369,Fidel O'Rourke has signed his first professional contract with LFC.,t3_gnvkjn,https://twitter.com/LFC/status/1263439395983470593,60,False,1590091257.0,12,0.94
370,Jordan Henderson interview | Captain on Reds' return to Melwood training,t3_gnx40g,https://www.liverpoolfc.com/news/first-team/396455-jordan-henderson-interview-return-to-training-melwood,33,False,1590097499.0,5,0.87
371,"Here’s something to debate: If Gerrard had left for Chelsea in 2005, who do you think could have replaced him?",t3_gnzj0d,https://www.reddit.com/r/LiverpoolFC/comments/gnzj0d/heres_something_to_debate_if_gerrard_had_left_for/,26,False,1590105692.0,61,0.77
372,Just some more tactic content to keep you busy,t3_go16ey,https://youtu.be/3aquVwSOQ3s,13,False,1590110931.0,0,0.75
373,Partners unite for LFC's 'Unity is Strength' appeal,t3_gnxfnh,https://www.liverpoolfc.com/news/community/396351-partners-unite-for-lfc-s-unity-is-strength-appeal,16,False,1590098686.0,1,0.82
374,Baba mane is back,t3_gnfntt,https://i.redd.it/9xb8uovnfyz41.jpg,731,False,1590024378.0,94,0.99
375,Emre Can on why Jadon Sancho should snub Man United transfer to stay at Dortmund: “I see no reason to put Manchester United above Borussia Dortmund. Neither from a sporting perspective nor in terms of attractiveness.”,t3_gng9x0,https://www.standard.co.uk/sport/football/manchester-united-transfer-news-jadon-sancho-emre-can-a4446011.html,478,False,1590026278.0,59,0.99
376,What Robbo was really laughing/pointing at,t3_gnhj8f,https://i.redd.it/neg44bcnwyz41.png,375,False,1590030099.0,9,0.98
377,"Jurgen Klopp: ""It is the players' choice and that is clear. I said before the session, 'You are here on free will. Usually you sign a contract and you have to be in when I tell you, in this case if you don't feel safe, you don't have to be here'. There are no restrictions, no punishment, nothing.”",t3_gnc8uv,https://www.skysports.com/football/news/11669/11991426/jurgen-klopp-vows-never-to-endanger-players-as-liverpool-training-resumes,727,False,1590013444.0,32,1.0
378,Guess who's back,t3_gn7h0p,https://i.redd.it/citrxu08qvz41.jpg,2135,False,1589991607.0,83,0.98
379,Back in familiar surroundings 😍,t3_gnd8kt,https://v.redd.it/t5omc8czsxz41,445,False,1590016767.0,28,0.99
380,The best captain in the world [OC],t3_gnmalj,https://i.redd.it/ezttn8spf0051.jpg,64,False,1590048613.0,6,0.83
381,"Clubs with the most domestic trophies in England - Reds only trail Man Utd, and have exactly twice as many trophies as City and Chelsea",t3_gnqmlh,https://twitter.com/goal/status/1234376803227176961,31,False,1590066054.0,11,0.77
382,Daily Discussion [2020-05-21],t3_gns52b,https://www.reddit.com/r/LiverpoolFC/comments/gns52b/daily_discussion_20200521/,17,False,1590073883.0,81,0.75
383,Inside Training: High spirits as the Reds return to training at Melwood,t3_gngzja,https://www.youtube.com/watch?v=Kj3IXlpFNzI,164,False,1590028432.0,30,0.98
384,They look so cool together. This is the first time I am watching them lined up together like this. Source: Unknown,t3_gnfpig,https://i.redd.it/5fklccfzfyz41.jpg,158,False,1590024527.0,23,0.95
385,"#LFC has donated 25,000 professional protective face coverings to its official charity, @LFCFoundation , which will work with the Liverpool Clinical Commissioning Group (CCG), to distribute them for free to the local health system.",t3_gndnxi,https://twitter.com/LFC/status/1263132433404354561?s=20,126,False,1590018141.0,0,0.99
386,Who do you think will score the goal that officially wins us the title?,t3_gngyts,https://www.reddit.com/r/LiverpoolFC/comments/gngyts/who_do_you_think_will_score_the_goal_that/,65,False,1590028374.0,87,0.93
387,Photos from Melwood as Reds return to training,t3_gnc33y,https://www.liverpoolfc.com/news/first-team/396321-photos-reds-return-to-training-melwood,97,False,1590012883.0,27,0.97
388,Lovren is on twitter now,t3_gnd850,https://i.redd.it/yqwrxhsvsxz41.jpg,52,False,1590016725.0,91,0.79
389,Barcelona Watchalong: Jürgen and Pep relive Anfield's greatest comeback,t3_gna3p5,https://video.liverpoolfc.com/player/0_87b98jyz/,78,False,1590004990.0,22,0.94
390,What does Liverpool have that LA doesn't? [From the film: Yesterday],t3_gndbcx,https://youtu.be/YXkmM4JJPNo,40,False,1590017017.0,15,0.84
391,Bobby coming back to training shirtless is some type of mood,t3_gmtv02,https://i.redd.it/hr8r1ceiirz41.jpg,1766,False,1589940586.0,44,1.0
392,Some Premier League clubs may decide to gamble in this summer’s transfer market but Liverpool won’t be one of them. Too much is up in the air for them to commit to anything. Werner will have to wait until there’s some clarity. [ @JamesPearceLFC ],t3_gn8q18,https://mobile.twitter.com/LFCTransferRoom/status/1262996592237428736,89,False,1589998146.0,41,0.94
393,Everton last won a trophy a quarter of a century ago,t3_gn8mmg,https://www.reddit.com/r/LiverpoolFC/comments/gn8mmg/everton_last_won_a_trophy_a_quarter_of_a_century/,82,False,1589997663.0,31,0.89
394,Enjoying seeing training pictures today!,t3_gnakt0,https://twitter.com/LFC/status/1263047595527725057?s=09,50,False,1590007063.0,6,0.94
395,"Jurgen Klopp Exclusive Interview On Liverpool Return To Training, Project Restart & The Bundesliga",t3_gndzkt,https://youtu.be/pnZKXMymdvQ,25,False,1590019168.0,0,0.89
396,Fashion sucks,t3_gms24z,https://i.redd.it/7elk9c422rz41.jpg,1874,False,1589935053.0,41,0.99
397,FA Cup final Rewind: Liverpool v West Ham from 2006 to be shown again in full,t3_gnapri,http://www.bbc.co.uk/sport/football/52623898,43,False,1590007663.0,10,0.91
