,title,name,url,score,locked,created,num of comment,upvote ratio
123,Origi's 2019 Champions League final goal with a plethora of alternate angles,t3_gu9ume,https://www.youtube.com/watch?v=SMkYkVGpx-c,86,False,1590998037.0,19,0.96
124,"⁣This is way deeper than just pointing out who’s staying quiet and who’s speaking up. Unfortunately for us black/brown people etc, this is a real life & everyday occurrence in so many different ways. For years & generations we’ve been screaming out for change and to be heard 1/3",t3_gu0luo,https://twitter.com/RhianBrewster9/status/1267084417740296192?s=19,263,False,1590966170.0,51,0.91
125,Some amazing Nostalgia right here! Lost my mind a few times!,t3_gu6hd3,https://youtu.be/yuJe6rk-dxM,84,False,1590986233.0,5,0.94
126,"Is right, Divock",t3_gtznkt,https://www.instagram.com/p/CA2qGGvJAdh/?igshid=1ah1kje5lvh3m,213,False,1590963125.0,24,0.94
127,Istanbul: Liverpool p3-3 AC Milan 2005,t3_gu7e84,https://www.holdingmidfield.com/istanbul-liverpool-p3-3-ac-milan-2005-tactics-tactical-analysis/,22,False,1590989344.0,2,0.79
128,Yossi Benayoun: It was a privilege to play for Liverpool,t3_gtwtj7,https://www.liverpoolfc.com/news/features/397185-yossi-benayoun-liverpool-privilege-interview,145,False,1590950012.0,26,0.97
129,Jürgen Klopp: 'Tony Yeboah had a big impact on German society',t3_gu0zlt,https://www.theguardian.com/football/2020/may/31/jurgen-klopp-tony-yeboah-had-a-big-impact-on-german-society?CMP=Share_iOSApp_Other,56,False,1590967568.0,9,0.88
130,Thomas Gronnemark | My work as throw-in coach at Liverpool FC | Ask the Coach,t3_gu2oyd,https://www.youtube.com/watch?v=FZOtKfWx7hI,33,False,1590973572.0,6,0.87
131,Government back Merseyside police to pave way for Premier League title to be lifted at Anfield,t3_gtvjut,https://www.thisisanfield.com/2020/05/government-back-merseyside-police-to-pave-way-for-premier-league-title-to-be-lifted-at-anfield/amp/?__twitter_impression=true,144,False,1590943467.0,13,0.97
132,Neco Williams reveals pre-debut pep talk from Jürgen Klopp,t3_gtwuki,https://www.liverpoolfc.com/news/first-team/397064-neco-williams-reveals-pre-debut-pep-talk-from-jurgen-klopp,77,False,1590950160.0,15,0.96
133,0 positive results from 1130 samples in Round 4 of Premier League COVID testing - Ornstein,t3_gtiwjl,https://twitter.com/David_Ornstein/status/1266795359482904576?s=19,1118,False,1590891445.0,75,0.99
134,Gini now knows how opposition attack feels,t3_gtxmht,https://streamable.com/gfwe7q,43,False,1590953988.0,2,0.87
135,Inside Training: Brilliant goals as group training returns to Melwood,t3_gtwo5w,https://www.youtube.com/watch?v=b56CS5cEAvI,57,False,1590949240.0,13,0.91
136,What are our realistic Summer Transfer options?,t3_gu5a07,https://www.reddit.com/r/LiverpoolFC/comments/gu5a07/what_are_our_realistic_summer_transfer_options/,8,False,1590982273.0,71,0.61
137,‎BBC The Documentary Podcast: The miracle of Istanbul (voice over from the man Dudek himself!),t3_gtzko9,https://podcasts.apple.com/nl/podcast/the-documentary-podcast/id73802620?l=en#episodeGuid=urn%3Abbc%3Apodcast%3Ap08fmhvc,23,False,1590962863.0,2,0.88
138,r/s[OC]cer in shambles,t3_gtcu93,https://v.redd.it/pyd6ypoj1w151,1874,False,1590867171.0,42,0.99
139,Sounds about right.,t3_gtcxv9,https://i.redd.it/n93qi47c3w151.png,1242,False,1590867714.0,29,0.99
140,"Liverpool hoping to seal a deal to sign Red Bull Leipzig striker Timo Werner before the Premier League resumes, but there could be a stumbling block.",t3_gtrp5b,https://twitter.com/RealKevinPalmer/status/1266851825891803137?s=20,52,False,1590924130.0,18,0.78
141,Daily Discussion [2020-05-31],t3_gtuhyj,https://www.reddit.com/r/LiverpoolFC/comments/gtuhyj/daily_discussion_20200531/,23,False,1590937948.0,65,0.9
142,"""What happens next as Liverpool close in on a move for Red Bull Leipzig striker Timo Werner? The story that dominates tomorrow's @sundayworld back page will be posted here later #LFC"" - Kevin Palmer(guy who broke VVD story back in 2017)",t3_gtk6yv,https://twitter.com/RealKevinPalmer/status/1266812196048326657,135,False,1590895870.0,35,0.95
143,"With a little help from my friend, We edited this photo of what our Premier League trophy will look like in all its glory.",t3_gth6mq,https://i.redd.it/a7aoxglrkx151.jpg,167,False,1590885686.0,21,0.97
144,"On this day in 1984, we lifted our fourth European Cup",t3_gtbm29,https://i.redd.it/ycljyso1hv151.jpg,609,False,1590860221.0,24,0.99
145,Inside the mind of Jurgen Klopp (NBC sports (,t3_gtly34,https://youtu.be/EAy4pBTCsoc,39,False,1590901874.0,6,0.87
146,Happy Birthday Steven Gerrard,t3_gt3xje,https://i.redd.it/unldyo20js151.jpg,2152,False,1590824554.0,63,0.99
147,The lads sing happy birthday for Gerrard,t3_gtduaq,https://video.liverpoolfc.com/player/0_khq2qyre/?feedId=4894e552-b329-4132-bf8d-f5fbafe95f20&page=0&pageSize=20&sortOrder=desc&title=Featured%20Videos&listType=LIST-DEFAULT&_ga=2.243886913.514930170.1590843245-521530871.1590843245,116,False,1590872099.0,39,0.98
148,Inside Training,t3_gteujt,https://streamable.com/abzt6m,70,False,1590876476.0,3,0.94
149,In celebration of The Greatest - Every Steven Gerrard goal for Liverpool,t3_gtbz90,https://youtu.be/DlceSLFU7co,130,False,1590862373.0,18,0.97
150,"In celebration of Steven Gerrard’s birthday, here’s his entire MOTM performance against AC Milan in the 2005 Champions League Final!",t3_gtdf1u,https://youtu.be/GZT8QM9Ix94,49,False,1590870050.0,5,0.89
151,I'd like to formally request the 'neutral venue' where 'Liverpool may win the title' be Old Trafford,t3_gsvl74,https://www.bbc.co.uk/sport/football/52846694,1703,False,1590796769.0,70,0.99
152,"For real, why are people so exited about our lost match ?",t3_gsz0ur,https://i.redd.it/d8yka7c35r151.jpg,907,False,1590807769.0,95,0.96
153,One of the most magical seasons!,t3_gtdfw5,https://www.youtube.com/watch?v=u_-u-H_89ME,27,False,1590870165.0,8,0.81
154,Every year the Chip Shop Awards run a competition for fake adverts. This is my favourite.,t3_gt1sla,https://thedrum-awards-files.s3.amazonaws.com/medias_images/project_full_detail/all_chipshops_uk_2020_page_06_image_0001.jpg,337,False,1590816820.0,31,0.98
155,Cannot wait to bless my eyes with this again LIVE!,t3_gspgee,https://i.redd.it/bd4b92dr6o151.jpg,2319,False,1590772051.0,18,0.98
156,Beatiful scenery in Norway.,t3_gsuyjm,https://i.redd.it/wzdqbce12q151.jpg,527,False,1590794642.0,36,0.99
157,Andrew Lonergan keeps the front 3 at bay 😉,t3_gsrpqa,https://v.redd.it/v0cwasz92p151,732,False,1590782625.0,52,0.99
158,Daily Discussion [2020-05-30],t3_gta0jv,https://www.reddit.com/r/LiverpoolFC/comments/gta0jv/daily_discussion_20200530/,20,False,1590851469.0,90,0.92
159,Brendan Rodgers: Leicester manager had coronavirus but now recovered (former Liverpool manager),t3_gt02v2,https://www.skysports.com/football/news/11712/11996896/brendan-rodgers-leicester-manager-had-coronavirus-but-now-recovered,148,False,1590811103.0,37,0.95
160,Liverpool have failed to score in just one Premier League game at Anfield in 𝗧𝗪𝗢 𝗬𝗘𝗔𝗥𝗦. Only Man City (Oct 2018) have stopped us scoring in a league game at home since May ‘18.,t3_gt2lqo,https://twitter.com/lfcdata/status/1266493461961887744?s=21,89,False,1590819605.0,8,0.96
161,Mum has been making more LFC buckets 😍,t3_gsqh5f,https://i.redd.it/z1646yhvlo151.jpg,566,False,1590777106.0,84,0.98
162,"Merseyside Police ""have no objections to any of the #EFC or #LFC home fixtures being played at their respective grounds"". It's the NPCC football lead who reportedly wants them at neutral grounds. That's DCC Mark Roberts, of SOUTH YORKSHIRE Police.",t3_gsx0z0,https://twitter.com/JimBoardman/status/1266414819600670720?s=19,141,False,1590801395.0,17,0.98
163,[Fabrizio Romano] Liverpool two weeks ago asked time to Leipzig for Timo Werner. The two clubs are not in official talks yet - but Liverpool are still Werner’s priority. He spoke with Klopp many times and he will wait Liverpool. He’d consider other bids only if Liverpool will decide to give up,t3_gswskb,https://twitter.com/FabrizioRomano/status/1266414210008993794,130,False,1590800637.0,19,0.97
164,Assist Kings indeed...,t3_gsr6p9,https://i.redd.it/76srffjivo151.jpg,320,False,1590780335.0,10,0.97
165,"Liverpool Stars Sadio Mane, Alisson and Divock Origi Reveal Secrets of Team's Culture and Success",t3_gt23z8,https://youtube.com/watch?v=9Pahrg0pzR8,36,False,1590817916.0,5,0.86
166,Gini. [OC],t3_gsv8p1,https://i.redd.it/rs5in3rx4q151.jpg,104,False,1590795612.0,5,0.96
167,Liverpool still hoping to sign £52.7m Timo Werner with player keen to join ( Fabrizio Romano),t3_gss714,https://amp.theguardian.com/football/2020/may/29/liverpool-still-hoping-to-sign-527m-timo-werner-with-player-keen-to-join?__twitter_impression=true,164,False,1590784559.0,50,0.97
168,Premier League clubs agree points-per-game system if season has to be cancelled - Mirror Online,t3_gswac5,https://www.mirror.co.uk/sport/football/news/premier-league-clubs-agree-points-22104672,73,False,1590799000.0,19,0.94
169,James Pearce: This neutral venues business is ridiculous. The vast majority of fans would heed warnings to stay away from grounds. Would be many more people congregating on beaches and in parks.,t3_gsqa58,https://twitter.com/JamesPearceLFC/status/1266310894037975040?s=09,202,False,1590776167.0,37,0.97
170,Scouse distancing,t3_gsd26l,https://imgur.com/rWb4RDJ,2871,False,1590723287.0,38,0.98
171,Today marks 35 years since the Heysel stadium disaster. Here’s a an introduction to the topic from The Anfield Wrap. Linked at the bottom is a podcast and a series of other articles on Heysel.,t3_gsoglk,https://www.reddit.com/r/LiverpoolFC/comments/gsoglk/today_marks_35_years_since_the_heysel_stadium/,236,False,1590767098.0,16,0.98
172,The Road to Istanbul: Liverpool 1-0 Chelsea 2005,t3_gt0vk3,https://www.holdingmidfield.com/the-road-to-istanbul-liverpool-1-0-chelsea-2005-tactics-tactical-analysis/,25,False,1590813679.0,5,0.89
173,"Statement from Premier League: “The PL’s ambition is to complete all of our remaining fixtures this season home and away, where possible. We are working with our clubs to ensure risks are assessed and minimised, while co-operating with the police at a local and national level.",t3_gst4dq,https://twitter.com/JamesPearceLFC/status/1266362361113227271?s=20,62,False,1590788118.0,6,0.94
174,‘You’ll Never Walk Alone’: From Broadway Tear-Jerker to Covid-Era Anthem,t3_gsy4fc,https://www.nytimes.com/2020/05/27/arts/music/youll-never-walk-alone-carousel-coronavirus.html,25,False,1590804886.0,2,0.88
175,How Jürgen Klopp creates a winning culture at Liverpool,t3_gsrpc7,https://youtu.be/-tL8XaGqtAA,43,False,1590782571.0,2,0.91
176,Happy friday reds! Never new dudek had a song dedicated to him until now. Thought you guys would enjoy this to kick off your weekend,t3_gsyrwf,https://youtu.be/vXqX-kfAtsA,14,False,1590806985.0,3,0.77
177,Police want any match where Liverpool can win title played at neutral venue | Football,t3_gsqjtx,https://www.theguardian.com/football/2020/may/29/police-want-any-match-where-liverpool-can-win-title-played-at-neutral-venue,41,False,1590777469.0,28,0.85
178,Liverpool - PL Goal Scorer Bar Chart Race,t3_gsx8xp,https://www.youtube.com/watch?v=64bhaW2oCgs,14,False,1590802109.0,0,0.82
179,"Understand police have identified SIX fixtures requiring neutral venues when PL restarts: Man City v Liverpool, Man City v Newcastle, Man Utd v Sheff Utd, Newcastle v Liverpool, Everton v Liverpool, the game in which Liverpool might take the title.",t3_gspe2e,https://twitter.com/ianherbs/status/1266289367527481347?s=21,47,False,1590771750.0,33,0.89
180,June 20th baby [OC],t3_gs7gjt,https://i.redd.it/t7702d7dpi151.jpg,1187,False,1590705626.0,41,0.98
181,I don't think BBC Sport could have picked a better image for the story about the restart date,t3_gsa3p9,https://i.redd.it/uzxr8bypej151.png,682,False,1590714192.0,21,1.0
182,The Road to Istanbul: Chelsea 0-0 Liverpool 2005,t3_gsr54w,https://www.holdingmidfield.com/the-road-to-istanbul-chelsea-0-0-liverpool-2005-tactics-tactical-analysis/,19,False,1590780150.0,0,0.91
183,Another bad day for the null and void brigade. The Premier League season set to resume on June 17. #LFC will have 3 weeks of contact training before returning to action on the weekend of June 20/21.,t3_gs8gg3,https://twitter.com/JamesPearceLFC/status/1266030081752915968?s=19,583,False,1590708919.0,37,0.99
184,#cleverrobbo,t3_gs3tzt,https://i.redd.it/t65u2cxehh151.jpg,1468,False,1590690850.0,38,0.99
185,Exclusive: Premier League will restart on June 17 with Aston Villa at home to Sheffield United and Manchester City hosting Arsenal.,t3_gs6i2o,https://twitter.com/TeleFootball/status/1266000347895672832?s=19,754,False,1590702166.0,224,0.99
186,Ok. This is just crazy.,t3_gsbx5b,https://i.redd.it/gbang6ppvj151.jpg,285,False,1590719867.0,90,0.96
187,Carra having a bit of fun on Twitter...,t3_gs9eog,https://i.redd.it/jzqrqd698j151.png,374,False,1590711991.0,13,0.99
188,We were gonna set the record of earliest premier league winners but instead we're gonna be the latest premier league winners,t3_gseno7,https://www.reddit.com/r/LiverpoolFC/comments/gseno7/we_were_gonna_set_the_record_of_earliest_premier/,155,False,1590728251.0,13,0.94
189,"Likely EFC v LFC will be played on June 20 as football returns. Crucially, MCFC v AFC seems certain to be played on June 17. Should City lose, Liverpool winning the derby would crown them Premier League Champions.",t3_gs722k,https://twitter.com/MaddockMirror/status/1266009350348386305,512,False,1590704192.0,72,0.99
190,Degsy with a cheeky kick at the end,t3_gsgpng,https://v.redd.it/5vwqtorl4l151,89,False,1590734993.0,8,0.92
191,Free talk Friday [2020-29-05],t3_gspbmw,https://www.reddit.com/r/LiverpoolFC/comments/gspbmw/free_talk_friday_20202905/,14,False,1590771424.0,22,0.85
192,"All 92 remaining PL matches to be broadcast live in UK by Sky Sports, BT Sport, BBC & Amazon. Staggered kick-off times: Friday 20:00; Saturday 12:30, 15:00, 17:30 and 20:00; Sunday 12:00, 14:00, 16:30, 19:00; Monday 20:00 Midweek games: Tues, Wed and Thurs 18:00 and 20:00",t3_gsaiwt,https://twitter.com/JamesPearceLFC/status/1266057851774140419?s=20,187,False,1590715522.0,67,0.99
193,"Transfer Watch: Update the English poker game @TimoWerner : Werner and @ToniRuediger are friends, played together @VfB . Rüdiger tries to convince the striker for @ChelseaFC [Falk]",t3_gspj6y,https://twitter.com/cfbayern/status/1266256743811563527,14,False,1590772415.0,11,0.72
194,Daily Discussion [2020-05-29],t3_gso3ay,https://www.reddit.com/r/LiverpoolFC/comments/gso3ay/daily_discussion_20200529/,15,False,1590765318.0,38,0.82
195,"Liverpool have won 100% of the competitive matches they have ever played in June/July in their history, most recently the 2019 Champions League final.",t3_gs7bsp,https://twitter.com/michael_reid11/status/1266006574524489728?s=19,232,False,1590705157.0,14,0.97
196,[David Lynch] Liverpool not currently expecting to play any of their remaining Premier League home games at neutral venues.,t3_gsd4dc,https://www.standard.co.uk/sport/football/liverpool-not-expecting-play-any-home-matches-neutral-venues-season-restarts-a4453756.html,80,False,1590723468.0,5,0.96
197,Understand no decision has been taken yet on whether #LFC will play their remaining 4 home league games at Anfield. Consultation ongoing. Senior Anfield officials confident that fans would heed pleas to stay away from the stadium on matchdays,t3_gsblx0,https://twitter.com/JamesPearceLFC/status/1266070326477295624?s=19,86,False,1590718913.0,24,0.94
198,Liverpool Players as Scenes from The Office (Quaranmeme 2020),t3_gs5eqc,https://www.youtube.com/watch?v=wCKKQ1mVqss,210,False,1590697880.0,34,0.97
199,Liverpool leapfrog Manchester City and Chelsea in KPMG's list of Europe's most valuable clubs to fifth as their valuation jumps 19 per cent to £2.25 billion,t3_gs32ls,https://i.redd.it/lcneiht66h151.png,350,False,1590687073.0,50,0.99
200,"On this day in 2018, Fab became a red!",t3_gs13mb,https://twitter.com/lfc/status/1265890547249471488?s=21,509,False,1590676933.0,24,0.99
201,Premier League Statement on the return of the season,t3_gsa9ck,https://www.premierleague.com/news/1674011/,48,False,1590714675.0,14,0.92
202,[Matt Lawton] PL clubs discuss proposal for remaining Liverpool home games and big London derbies to be played at neutral venues,t3_gs8zmq,https://www.thetimes.co.uk/article/liverpool-home-games-could-be-at-neutral-grounds-with-premier-league-to-return-on-june-17-57mp2tvg0,38,False,1590710652.0,23,0.88
203,Inside Training,t3_gs6ubv,https://streamable.com/9jtq9u,58,False,1590703419.0,8,0.92
204,"John Green on Twitter: Football fans, I wrote something for you about the long and winding history of ""You'll Never Walk Alone"" and Jerzy Dudek's journey from a town called Szczyglowice to That Night in Istanbul",t3_gs657h,https://twitter.com/sportswithjohn/status/1265978612991352837?s=21,57,False,1590700810.0,10,0.89
205,Deeney proving to be a bit bitter about the season restarting,t3_grw3q8,https://i.redd.it/ter39mn5ke151.jpg,472,False,1590655531.0,163,0.92
206,LFC announces appointment of new U23s and U18s coaches,t3_gs8x29,https://www.liverpoolfc.com/news/academy/396957-lfc-announces-appointment-of-new-u23s-and-u18s-coaches,28,False,1590710439.0,4,0.86
207,Ki-Jana Hoever looking all grown up,t3_groz2r,https://i.redd.it/pjx5v591mc151.jpg,1357,False,1590631864.0,95,0.99
208,Jordan Henderson Compilation 19/20,t3_gsd9id,https://www.reddit.com/r/LiverpoolFC/comments/gsd9id/jordan_henderson_compilation_1920/,10,False,1590723890.0,7,0.67
209,Uefa rewriting history?!,t3_gs12gy,https://i.redd.it/4n281u2jbg151.png,77,False,1590676777.0,10,0.91
210,"[Ornstein] Some Premier League clubs are calling for no relegation if COVID stops season again, citing fixture imbalances",t3_gs3uy5,https://twitter.com/David_Ornstein/status/1265913267580538880?s=20,42,False,1590690973.0,28,0.92
211,Abdi Sharif extends his contract,t3_gs3cil,https://twitter.com/lfc/status/1265931751450435584?s=21,40,False,1590688479.0,9,0.91
212,The Road to Istanbul: Juventus 0-0 Liverpool 2005,t3_gs986g,https://www.holdingmidfield.com/the-road-to-istanbul-juventus-0-0-liverpool-2005-tactics-tactical-analysis/,11,False,1590711414.0,5,0.78
213,What can I do to make Liverpool's eventual league win memorable for my brother?,t3_gs86vj,https://www.reddit.com/r/LiverpoolFC/comments/gs86vj/what_can_i_do_to_make_liverpools_eventual_league/,12,False,1590708045.0,11,0.71
214,"New Liverpool Training Session ft Henderson, Robertson, Wijnaldum",t3_gs3sab,https://www.youtube.com/watch?v=f4skiCHKoro&feature=share,26,False,1590690616.0,1,0.87
215,Daily Discussion [2020-05-28],t3_gs1fuy,https://www.reddit.com/r/LiverpoolFC/comments/gs1fuy/daily_discussion_20200528/,29,False,1590678693.0,72,0.92
216,"On this day two years ago,the day after the defeat to Madrid in the Champions League final, Jurgen Klopp delivers a promise... ‘We’ll bring it back to Liverpool.’",t3_grfye3,https://v.redd.it/emufzzz1s9151,1643,False,1590597689.0,83,0.99
217,Milner at it again on Instagram! This time he's talking to Robbo! 😅,t3_grgykz,https://i.imgur.com/dYBMaTv.jpg,933,False,1590602752.0,24,0.99
218,Marjo Grujic's opener Vs RB Leipzig (0-1),t3_grn6ud,https://www.clippituser.tv/c/dylxxb,240,False,1590626553.0,35,0.98
219,Liverpool among clubs to argue against paying £330m rebate to broadcasters,t3_grp9os,https://www.theguardian.com/football/2020/may/27/liverpool-among-clubs-argue-against-paying-330m-rebate-broadcasters-premier-league?CMP=Share_iOSApp_Other,117,False,1590632756.0,43,0.97
220,Agent Jose on Twitter,t3_grd2es,https://i.redd.it/ttwgp5e2n8151.jpg,1318,False,1590583784.0,61,0.99
221,Liverpool withdraw from Timo Werner talks and won't pursue RB Leipzig star transfer - David Maddock,t3_grq6pe,https://www.mirror.co.uk/sport/football/transfer-news/liverpool-withdraw-timo-werner-talks-22097359,84,False,1590635603.0,115,0.85
222,BREAKING: The Premier League have confirmed four positive tests for coronavirus from three clubs after the third round of mass testing.,t3_grnzwe,https://twitter.com/skysportsnews/status/1265694124050714626?s=21,104,False,1590628940.0,35,0.97
223,[David Lynch] Jurgen Klopp will opt against signing a right-back when the transfer window opens due to his faith in Neco Williams. Curtis Jones and Harvey Elliott could also have big roles to play in the near future.,t3_grfsr0,https://www.standard.co.uk/sport/football/liverpool-academy-stars-who-could-save-transfer-millions-a4450396.html,399,False,1590596888.0,101,0.99
224,Liverpool have not held Werner transfer talks with RB Leipzig,t3_grs3we,https://www.liverpoolecho.co.uk/sport/football/football-news/liverpool-not-held-talks-rb-18321055,29,False,1590641593.0,17,0.81
225,Contact training to resume,t3_grhyby,https://www.liverpoolfc.com/news/first-team/396969-premier-league-statement-contact-training-to-resume,150,False,1590607508.0,27,0.97
226,STRIVE FOR GREATNESS - Mohamed Salah Motivational Video (THE EGYPTIAN KING),t3_grumuq,https://youtu.be/3QE5gZdvDhw,18,False,1590650125.0,0,0.91
227,Michael Owen explains how one punch led to Emile Heskey friendship,t3_grqe4x,https://www.liverpoolecho.co.uk/sport/football/football-news/former-liverpool-striker-michael-owen-18316866,21,False,1590636226.0,5,0.78
228,"On this day in 1981, we won the European Cup in Paris!",t3_grhtyv,https://en.wikipedia.org/wiki/1981_European_Cup_Final,77,False,1590606922.0,6,0.92
229,"Liverpool want Werner but for less than his release clause of €55M. Liverpool hope to get him for less but Leipzig CEO Oliver Mintzlaff has said: ""He’s not getting any cheaper. We will not sell a player below value if he is under contract for over a year.”",t3_greyt6,https://www.bild.de/bild-plus/sport/fussball/fussball/fc-liverpool-wie-juergen-klopp-jetzt-um-leipzigs-timo-werner-feilscht-70881812.bild.html,153,False,1590592782.0,35,0.97
230,"Liverpool Training Session ft Salah, Van Dijk, Mane. Firmino",t3_grngns,https://youtu.be/WpyQqLVB51E,28,False,1590627379.0,0,0.83
231,The Miracle of Istanbul: An oral history of Liverpool's 2005 Champions League final win (UEFA.com article),t3_grni8v,https://www.uefa.com/uefachampionsleague/news/025d-0f782b45c942-3e20b8c30dfa-1000--miracle-of-istanbul-an-oral-history-of-liverpool-s-2005-champio/?iv=true%3Futm_source%3Drec&utm_campaign=ALLACCESS-ACT90-ENG--200527&utm_medium=email,16,False,1590627512.0,0,0.9
232,Anyone who said improving throw-ins wouldn’t matter have not seen the goal that won us the European cup in -81.,t3_grglkz,https://twitter.com/theanfieldwrap/status/1265555126456061952?s=21,56,False,1590600975.0,3,0.88
233,Liverpool FC according to Football Twitter.,t3_gqyt5j,https://i.redd.it/z0e5hfswk4151.jpg,1630,False,1590534631.0,185,0.97
234,Does anyone remember this weird incident during a match about 10-15 years ago?,t3_grhf8h,https://www.reddit.com/r/LiverpoolFC/comments/grhf8h/does_anyone_remember_this_weird_incident_during_a/,43,False,1590605020.0,9,0.87
235,One season wonder ?,t3_gr34dt,https://i.imgur.com/XDaBXOS.jpg,730,False,1590548136.0,51,0.98
236,Ag.™₰ Mrs. Scouser on Twitter baywatch Robertson,t3_grl494,https://twitter.com/t4kenquickly/status/1265604677086973959?s=21,17,False,1590619869.0,1,0.75
237,"Told no significant issues raised in today’s talks with Premier League doctors, players and managers to prevent return to contact training. Vote tomorrow set to be approved. All 20 clubs have now completed third round of tests.",t3_grexf7,https://twitter.com/skysports_bryan/status/1265362923251290113?s=21,51,False,1590592588.0,4,0.9
238,"[Dominic King] Adam Lallana will leave this summer, with Leicester City hot favourites to sign the England international on a free transfer. There is also interest from Burnley but all the indications are that the 31-year-old will reunite with his former manager Brendan Rodgers.",t3_gr4875,https://twitter.com/LFCTransferRoom/status/1265365805455364097,425,False,1590551425.0,70,0.99
239,Mb00ppe 2021?,t3_gr5ais,https://i.redd.it/tmprsi0r86151.jpg,352,False,1590554780.0,42,0.91
240,My classroom.,t3_gr9peq,https://i.redd.it/52v9gkwbi7151.jpg,161,False,1590570096.0,15,0.95
241,How good was Owen?,t3_grgaby,https://www.reddit.com/r/LiverpoolFC/comments/grgaby/how_good_was_owen/,34,False,1590599401.0,79,0.83
242,Look at how close Nesta was when Xabi connected with the penalty after encroaching - remarkable that Xabi got to the rebound first,t3_gqwlmj,https://i.redd.it/2j7a91kux3151.jpg,1208,False,1590526875.0,84,0.98
243,The Road to Istanbul: Liverpool 2-1 Juventus 2005,t3_grj9ze,https://www.holdingmidfield.com/the-road-to-istanbul-liverpool-2-1-juventus-2005-tactics-tactical-analysis/,15,False,1590613235.0,0,0.89
244,"Red Bull Salzburg boss Jesse Marsch says Liverpool's £7m deal for Takumi Minamino ""way, way, way too cheap.""",t3_gqyxpa,https://www.liverpoolecho.co.uk/sport/football/football-news/exclusive-rb-salzburg-manager-details-18309813,321,False,1590535044.0,76,0.98
245,Jordan Henderson: Premier League trophy win without fans would be 'pretty strange',t3_gr5hti,https://www.bbc.co.uk/sport/football/52810447,110,False,1590555433.0,14,0.96
246,Daily Discussion [2020-05-27],t3_grevkf,https://www.reddit.com/r/LiverpoolFC/comments/grevkf/daily_discussion_20200527/,17,False,1590592334.0,51,0.82
247,"[Dominic King] Newcastle have sounded out Xherdhan Shaqiri’s representatives about a move this summer. Liverpool will not stand in his way if the initial talks firm up. Shaqiri would be interested, providing takeover goes through",t3_gr27as,https://twitter.com/dominicking_dm/status/1265343138010406913,163,False,1590545287.0,67,0.98
248,My favourite game: Gerrard and Torres humiliate Manchester United,t3_gqxc41,https://www.theguardian.com/sport/2020/may/26/my-favourite-game-gerrard-and-torres-humiliate-manchester-united?CMP=Share_iOSApp_Other,202,False,1590529505.0,13,0.97
