,title,name,url,score,locked,created,num of comment,upvote ratio
536,Leaked Nike Merchandise (Ofoball),t3_gj0q4q,https://www.reddit.com/r/LiverpoolFC/comments/gj0q4q/leaked_nike_merchandise_ofoball/,25,False,1589410956.0,49,0.77
537,On this day in 2006: Liverpool beat West Ham 3-1 on penalties to win the FA Cup final after a stunning last minute equaliser from Steven Gerrard,t3_gimmwk,https://streamable.com/02zteb,369,False,1589353521.0,47,1.0
538,Trent Alexander Arnold's MOTM performance vs West Ham. PL's finest.,t3_giwf02,https://youtu.be/iU31mdlutN0,38,False,1589394320.0,6,0.93
539,Bayern Munich chief hits out at Liverpool transfer target Timo Werner,t3_giycrg,https://metro.co.uk/2020/05/13/bayern-munich-liverpool-man-utd-chelsea-transfer-timo-werner-12695153/,24,False,1589402817.0,25,0.88
540,Best possible end to the season?,t3_gj08dq,https://www.reddit.com/r/LiverpoolFC/comments/gj08dq/best_possible_end_to_the_season/,15,False,1589409391.0,41,0.76
541,"Wolves staff involved in PL COVID19 pilot test gave nose + mouth swabs - uncomfortable but over in 30sec & drive-through done inside 5min. Process to be replicated at other 19 clubs, results within 24 hours. All private, cost just under £4m",t3_giffvq,https://twitter.com/david_ornstein/status/1260256012356980736,621,False,1589332298.0,49,0.99
542,LFC Shirts: The Adidas Years #5 (2010/11),t3_gitgyu,https://i.redd.it/9sub367f7hy41.png,47,False,1589379967.0,27,0.89
543,"As it’s the anniversary of Gerrard’s final, I thought I’d post my favourite post match montage [potato quality]",t3_gixjot,https://youtu.be/oiof3Zp4SFM,15,False,1589399584.0,4,0.81
544,Moroccan Real Betis central defender Zou Feddal might have just leaked that he is joining Liverpool on his Twitter,t3_gil1ey,https://imgur.com/sWLRzf6,131,False,1589348315.0,60,0.92
545,Daily Discussion [2020-05-13],t3_giu1px,https://www.reddit.com/r/LiverpoolFC/comments/giu1px/daily_discussion_20200513/,18,False,1589382724.0,53,0.86
546,"Premier League clubs ‘look set to play out season at own grounds’ after positive talks between police, government and FA",t3_giee0s,https://www.thetimes.co.uk/edition/sport/premier-league-clubs-look-set-to-play-out-season-at-own-grounds-rvrsb8rk8?utm_medium=Social&utm_source=Twitter#Echobox=1589300011,245,False,1589329202.0,40,0.98
547,Yesterday's post reminded me of my favourite footage (and reaction) to Gini breaking ankles. Credit to DjMariio on YT,t3_gi7jif,https://streamable.com/xr5ctr,948,False,1589302583.0,49,0.99
548,Rank these best seasons of our 8 great forwards in the PL era from best to worst! - Achievements included inside,t3_gis8pi,https://www.reddit.com/r/LiverpoolFC/comments/gis8pi/rank_these_best_seasons_of_our_8_great_forwards/,21,False,1589374386.0,21,0.85
549,"On this day in 2001, Michael Owen scored twice to win the FA Cup Final for Liverpool vs Arsenal",t3_gi8ykw,https://streamable.com/xge195,358,False,1589309554.0,57,0.97
550,Bobby doing Bobby things! Lit skill in a tight spot! - Credit to LiverpoolFC Instagram.,t3_gi13wv,https://v.redd.it/by9flv47k8y41,1802,False,1589275396.0,45,0.99
551,Liverpool U9s quiz Trent after signing first contract,t3_giev36,https://www.youtube.com/watch?v=VQNFuT7qkVw&feature=share,59,False,1589330604.0,5,0.91
552,Anyone know where I can get a Liverpool jersey for a dog?,t3_giiefj,https://www.reddit.com/r/LiverpoolFC/comments/giiefj/anyone_know_where_i_can_get_a_liverpool_jersey/,25,False,1589340392.0,18,0.79
553,Jürgen Klopp's heartwarming surprise calls to three Liverpool fans,t3_gi7w7c,https://www.youtube.com/watch?v=FcC7DsQM55c,155,False,1589304311.0,4,0.98
554,The roots of LFC,t3_gijw9h,https://www.reddit.com/r/LiverpoolFC/comments/gijw9h/the_roots_of_lfc/,10,False,1589344800.0,27,0.66
555,Thierry Henry reveals WHY he wanted Liverpool to go the season unbeaten,t3_gi3d2v,https://www.youtube.com/watch?v=wTmyYEJejN8,90,False,1589283714.0,24,0.94
556,Premier League can resume next month as government gives green light to sport returning,t3_ghne7r,https://www.independent.co.uk/sport/football/premier-league/premier-league-return-date-when-uk-lockdown-epl-government-announcement-a9508506.html,1193,False,1589231993.0,150,0.98
557,Sent them back to the shadow realm,t3_ghjmz6,https://v.redd.it/pko4mnzki3y41,1626,False,1589214204.0,79,0.99
558,"Following today’s meeting of Shareholders, Premier League Chief Executive Richard Masters has said the 20 clubs are united in their desire to get the 2019/20 season back up and running.",t3_ghuehe,https://www.liverpoolfc.com/news/announcements/395401-premier-league-statement-may-11,212,False,1589253580.0,29,0.98
559,Daily Discussion [2020-05-12],t3_gi68qc,https://www.reddit.com/r/LiverpoolFC/comments/gi68qc/daily_discussion_20200512/,22,False,1589296331.0,76,0.85
560,"On this day in 2007, Lucas became a red!",t3_ghiamr,https://i.redd.it/1bmyv663y2y41.jpg,1745,False,1589207304.0,57,0.99
561,FA chairman Greg Clarke told Premier League clubs today the governing body will not sanction 'no relegation' or voiding the season,t3_ghqnj5,https://twitter.com/martynziegler/status/1259865254609268737,242,False,1589242700.0,50,0.99
562,Memorable matches (European Edition),t3_gi411d,https://www.reddit.com/r/LiverpoolFC/comments/gi411d/memorable_matches_european_edition/,17,False,1589286459.0,70,0.74
563,My 11 year old daughter drew this picture. I think it’s pretty cool. We are Aussie supporters and her favourite player is Mane.,t3_ghivw2,https://i.redd.it/r0tn4c0v63y41.jpg,524,False,1589210257.0,27,0.95
564,"Dominic King: Work will restart on Liverpool's new training facility at Kirkby, following an eight-week break. There is no indication yet, though, when the first team squad will be able to move over. Still potential for them to remain at Melwood for another 12 months",t3_ghqdj6,https://twitter.com/DominicKing_DM/status/1259876379539234817,98,False,1589241870.0,2,0.98
565,Premier League clubs told 2019/20 season must be decided ‘on sporting merit’,t3_ghpd2u,https://www.independent.co.uk/sport/football/premier-league/pl-project-restart-coronavirus-latest-sporting-merit-relegation-a9508601.html,107,False,1589238694.0,28,0.97
566,Roberto Firmino - Overall 2019/20,t3_ghtpfc,https://www.youtube.com/watch?v=aUqdKlskRpo&feature=youtu.be,46,False,1589251639.0,8,0.86
567,Big Shaq Illustration (OC),t3_ghnif0,https://i.redd.it/yqf8u4fr05y41.jpg,99,False,1589232428.0,5,0.94
568,Premier League agree solution for out of contract players,t3_ghrwqi,https://www.independent.co.uk/sport/football/premier-league/summer-transfer-window-contracts-june-out-free-agents-a9509146.html,42,False,1589246422.0,10,0.9
569,"Ralf Ragnick (RB Leipzig’s Head of Football): ""Timo would fit a club like Liverpool, which is similar to our style of play. I would prefer if he stayed. The best place to see him is where a team switches quickly or quickly counterpresses after losing a ball."" [@BILD_Sport]",t3_ghjeb5,"https://m.bild.de/sport/fussball/fussball/rb-leipzig-was-ex-trainer-ralf-rangnick-sturm-star-timo-werner-raet-70562894,view=amp.bildMobile.html?__twitter_impression=true",184,False,1589212948.0,30,0.98
570,Premier League to ask government to reconsider neutral grounds directive at request of more than half the clubs. Story with @martynziegler to follow on @TimesSport [Matt Lawton on Twitter],t3_ghp4rj,https://twitter.com/lawton_times/status/1259857595424178178?s=21,51,False,1589237987.0,18,0.94
571,I now know what been alert is like,t3_gh598m,https://i.redd.it/gl6wnqwizyx41.jpg,2692,False,1589159360.0,51,0.98
572,My cousin’s mom surprised him with an Afghan she made for him. She did an amazing job!,t3_ghctkj,https://i.redd.it/47fnpn4m21y41.jpg,595,False,1589184615.0,24,0.99
573,"""You'll Never Walk Alone"" Virtual Choir/Orchestra 15 Countries: 300 People",t3_ghrt5j,https://youtu.be/6gpoJNv5dlQ,26,False,1589246123.0,5,0.82
574,Virgil van Dijk tells Jamie Redknapp why his appetite for success is greater than ever.,t3_ghmlrs,https://www.skysports.com/watch/video/sports/football/11986304/van-dijk-my-journey-hasnt-finished-yet,58,False,1589228830.0,10,0.94
575,Premier League Can Return Next Month As Govt. Green Light To Sport Returning,t3_ghoigk,https://www.independent.co.uk/sport/football/premier-league/premier-league-return-date-when-uk-lockdown-epl-government-announcement-a9508506.html?utm_medium=Social&utm_source=Facebook#Echobox=1589202192,20,False,1589235960.0,1,0.78
576,Each premier league teams biggest rival according to fans,t3_ghehzb,https://i.redd.it/b9k3cueal1y41.jpg,143,False,1589190893.0,94,0.96
577,Lucas Leiva interview | 'I'm so happy to watch Liverpool winning as a fan',t3_ghjo2m,https://www.liverpoolfc.com/news/features/395109-lucas-leiva-interview-i-m-so-happy-to-watch-liverpool-winning-as-a-fan,27,False,1589214359.0,3,0.82
578,"Franco Baresi on modern defenders - 'If I had to name names, then the one who really stands out is Virgil van Dijk, who’s shown the quality, character and strength that a defender needs to have to be a successful leader of a team like Liverpool.'",t3_ghawsa,https://www.fifa.com/worldcup/news/baresi-real-football-fans-know-how-important-defenders-are,169,False,1589178006.0,13,0.97
579,My favorite celebration from this season! Virgil with the sunset in the back 😍,t3_ggxefi,https://v.redd.it/sybpo4f99wx41,2116,False,1589126425.0,34,0.99
580,Stay Alert,t3_gh5qa8,https://i.imgur.com/7y3VS6I.jpg,225,False,1589160955.0,4,0.95
581,Daily Discussion [2020-05-11],t3_ghivkc,https://www.reddit.com/r/LiverpoolFC/comments/ghivkc/daily_discussion_20200511/,18,False,1589210210.0,30,0.82
582,LFC Shirts: The Adidas Years #6 (2011/12),t3_ghhm1o,https://i.redd.it/kpvinmx7o2y41.png,18,False,1589204004.0,11,0.86
583,Monday Moan Thread [11-5-2020],t3_ghic8r,https://www.reddit.com/r/LiverpoolFC/comments/ghic8r/monday_moan_thread_1152020/,16,False,1589207525.0,36,0.78
584,"Happy 32nd birthday, Adam Lallana!",t3_ggvgy0,https://i.redd.it/aex70z4lgvx41.jpg,869,False,1589116670.0,44,0.99
585,the best goalkeeper and quite possibly...,t3_gh30eg,https://i.redd.it/thinmaf0cyx41.png,140,False,1589151668.0,13,0.96
586,Eight Premier League clubs to argue against using neutral venues in blow to Project Restart,t3_gh82ko,https://www.telegraph.co.uk/football/2020/05/10/eight-premier-league-clubs-argue-against-using-neutral-venues/,36,False,1589168706.0,68,0.86
587,Wholesome meme,t3_ggkdj8,https://i.redd.it/o23wmeb55sx41.jpg,3879,False,1589076503.0,15,0.98
588,"Arsenal GK Bernd Leno ""For me it's clear, it's Alisson.He's good at everything and his stats are also very good. He's played a number of big games for Liverpool and for me it's clear that he's the best goalkeeper at the moment.""",t3_ggx88e,https://www.mirror.co.uk/sport/football/news/bernd-leno-explains-alisson-better-22002598,260,False,1589125535.0,21,0.99
589,What is your opinion about leaked 20/21 home kit design?,t3_gi303w,https://www.reddit.com/r/LiverpoolFC/comments/gi303w/what_is_your_opinion_about_leaked_2021_home_kit/,0,False,1589282299.0,7,0.25
590,'We were sure Trent would become one of the best' - Lucas Leiva,t3_ggxtts,https://www.liverpoolfc.com/news/first-team/395193-lucas-leiva-discusses-trent-alexander-arnold,178,False,1589128642.0,8,0.99
591,Footballers have a duty to return with 'normal' premier league potentially years away,t3_gh10it,https://www.mirror.co.uk/sport/football/news/footballers-duty-return-normal-premier-22002984,50,False,1589144153.0,22,0.87
592,Premier League chief Richard Masters: Cancelling season discussed for first time,t3_ghxgf2,https://www.espn.com/soccer/english-premier-league/story/4093781/premier-league-chief-richard-master-cancelling-season-discussed-for-first-time,0,False,1589263167.0,3,0.31
593,Coronavirus: Brighton player tests positive one day before PL meeting,t3_ggzjl7,https://www.skysports.com/football/news/11741/11986015/coronavirus-third-brighton-player-tests-positive-chief-executive-paul-barber-confirms,44,False,1589137507.0,22,0.87
594,"Not sure if this was posted here already, but made me chuckle. (Got this as a forward on WhatsApp, original creator / source unknown)",t3_gghz17,https://v.redd.it/86fjgcugirx41,1505,False,1589069004.0,60,0.98
595,"Vincent Kompany: ""Best defender in Premier League history? I would bring it back to Virgil Van Dijk. He hasn't been on the scene as long as Terry or Ferdinand but the signs he showed in last few years just make it so obvious""",t3_ggkdmb,https://twitter.com/sporf/status/1259091496919355393?s=21,386,False,1589076511.0,41,0.99
596,Nantes have struck a deal to sign 22-year-old Liverpool midfielder Pedro Chirivella on a free transfer to a 3-year contract,t3_ggcs15,https://twitter.com/GFFN/status/1259057827924127746,1168,False,1589047001.0,138,0.99
597,Daily Discussion [2020-05-10],t3_ggwva8,https://www.reddit.com/r/LiverpoolFC/comments/ggwva8/daily_discussion_20200510/,14,False,1589123634.0,46,0.81
598,Some of klopps best interviews with BT sports,t3_ggeih0,https://v.redd.it/1nypq9pzeqx41,359,False,1589055629.0,21,0.99
599,Jamie Carragher - True Liverpool legend,t3_ggpeqa,https://youtu.be/1cKViHd4xdc,43,False,1589092906.0,4,0.89
600,Virgil van Dijk: I keep looking and working for improvement,t3_gglgsl,https://www.liverpoolfc.com/news/first-team/395262-virgil-van-dijk-i-keep-looking-and-working-for-improvement,72,False,1589079943.0,2,0.95
601,I Got this monstrosity in my drawer. Memorabilia from my first match,t3_ggen4t,https://i.redd.it/ef9sdtswgqx41.jpg,138,False,1589056247.0,38,0.95
602,A little drawing I did of our working class hero!,t3_gg52tu,https://i.redd.it/id3k87ypumx41.jpg,1018,False,1589012463.0,41,0.99
603,Jürgen Klopp: I saw Steven Gerrard while I was on the phone to Gerard Houllier!,t3_ggf0it,https://www.liverpoolfc.com/news/first-team/395061-jurgen-klopp-steven-gerrard-gerard-houllier-liverpool-lockdown,90,False,1589057939.0,16,0.96
604,The Liverpool Counter-Attack (Video analysis),t3_gghzbi,https://www.youtube.com/watch?v=St4yPBY4mlY&t=,39,False,1589069030.0,4,0.92
605,I Drew this today 2.0,t3_gg050a,https://i.redd.it/acwdfnuohlx41.png,869,False,1588995975.0,11,0.97
606,The 86 Cup Final!,t3_gghqqg,https://www.theguardian.com/football/live/2020/may/09/everton-v-liverpool-1986-fa-cup-final-live?CMP=Share_iOSApp_Other,20,False,1589068267.0,0,0.87
607,PSA: Guardian Football Weekly (excellent Podcast) is rewatching 2005 CL Final Saturday 9 May 4PM UK,t3_ggeofp,https://www.reddit.com/r/LiverpoolFC/comments/ggeofp/psa_guardian_football_weekly_excellent_podcast_is/,19,False,1589056409.0,3,0.77
608,"""Kylian Mbappe will only cost Liverpool £40m upfront"" | Finance expert Kieran Maguire explains.",t3_gh40mh,https://youtu.be/UlniiipXd3E,0,False,1589155127.0,23,0.41
609,LFC Shirts: The Warrior Years #1 (2012/13),t3_gg9z0z,https://i.redd.it/rx145901jox41.png,57,False,1589032759.0,33,0.91
610,"Apparently Harvey Elliott said he would promote £800 shoes on IG, took the shoes, didn't promote it then blocked people for calling him out",t3_gg609d,https://twitter.com/jaysergeant94/status/1258770073965203457,105,False,1589015990.0,60,0.9
611,Every Premier League Goal 2002/03: Baros and Murphy make their mark,t3_ggcb1b,https://www.youtube.com/watch?v=19RPDS_XDuU,21,False,1589044592.0,5,0.83
612,We shall not forget or let them forget!,t3_gfo96a,https://i.redd.it/ujf30osvphx41.jpg,2018,False,1588950302.0,49,0.98
613,Daily Discussion [2020-05-09],t3_ggau98,https://www.reddit.com/r/LiverpoolFC/comments/ggau98/daily_discussion_20200509/,21,False,1589037106.0,68,0.81
614,Liverpool vs Cardiff in the 2012 Carling Cup final has been posted in full on the EFL YouTube!,t3_gg7ay2,https://youtu.be/CibD6lXa9Cg,47,False,1589021184.0,13,0.92
615,I Drew this today,t3_gfr4p2,https://i.imgur.com/Jr0OhUI.png,806,False,1588964506.0,15,0.98
616,Would Kalidou Koulibaly be a good fit for the club?,t3_ggz52m,https://prosportsextra.com/transfer-rumors-liverpool-likely-to-sign-kalidou-koulibaly/,0,False,1589135512.0,16,0.39
617,"Final Premier League table based on weighted home and away points-per-game formula proposed for League 1 & 2.Liverpool will finish with 107 points ,30 pts ahead of Man city.West Ham will finish bottom 3 alongside Villa and Norwich.",t3_gftlw4,https://www.mirror.co.uk/sport/football/news/premier-league-table-decided-weighted-21995675,300,False,1588974705.0,64,0.98
618,Shared to me by mate. A man u fan posted one year ago today.,t3_gfhshm,https://i.redd.it/ykjtkn1sgfx41.jpg,3399,False,1588923026.0,116,0.99
619,Bruno Fernandes making it into the BBC Premier League Team of the Season,t3_gflubk,https://v.redd.it/v3577lr6rgx41,1147,False,1588938693.0,32,0.97
620,Our Number Nine🎶,t3_gfrrd0,https://i.redd.it/28djjjqo4jx41.jpg,261,False,1588967387.0,5,0.97
621,Five substitutions per team permitted by IFAB to help aid players' return Competitions also permitted to drop VAR mid-season; Premier League not expected to do so,t3_gftacl,https://www.skysports.com/football/news/11095/11985236/five-substitutions-per-team-permitted-by-ifab-to-help-aid-players-return,117,False,1588973512.0,14,0.98
622,US Replay of the Merseyside Derby in December,t3_gg6gg9,https://www.reddit.com/r/LiverpoolFC/comments/gg6gg9/us_replay_of_the_merseyside_derby_in_december/,10,False,1589017760.0,10,0.71
623,"Milner & Robertson decide the comedy programmes GOAT List | Del Boy, David Brent & much more",t3_gfuw6b,https://www.youtube.com/watch?v=GbKI-dlYoKI,54,False,1588979372.0,20,0.93
624,[OC] Fernando Torres: How Injury Dampened the Great Career of Liverpool Legend & Football Talent El Niño,t3_gftshi,https://www.reddit.com/r/LiverpoolFC/comments/gftshi/oc_fernando_torres_how_injury_dampened_the_great/,53,False,1588975358.0,23,0.87
625,Liverpool captain Jordan Henderson wins the #PremierLeague Player of the Season with 23% of the votes!,t3_gf81z7,https://twitter.com/BBCMOTD/status/1258404992316309504?s=20,2880,False,1588892218.0,97,0.98
626,Minimatch LFC - Barca,t3_gg176y,https://www.reddit.com/r/LiverpoolFC/comments/gg176y/minimatch_lfc_barca/,12,False,1588999263.0,9,0.8
627,retro robbo!,t3_gfmfe3,https://i.redd.it/g2mfo3zbzgx41.jpg,188,False,1588941372.0,9,0.93
628,One year ago today,t3_gff0vf,https://i.redd.it/z8x7b1f7pex41.jpg,641,False,1588913752.0,17,0.98
629,Premier League Daily – 5th May 2020,t3_gg6bjz,https://youtu.be/ynyreCPJBeY,3,False,1589017225.0,0,0.55
630,Robbo on the latest episode of The Peter Crouch Podcast,t3_gfmrtb,https://open.spotify.com/episode/5JUgRkB25xCV1CMum2kHZx?si=nbJUpxy4Tn2Ej-2Nz9_WUA,100,False,1588942967.0,22,0.98
631,Never Forget ❤️,t3_gfdv2a,https://i.redd.it/ob0cy1zdeex41.jpg,495,False,1588910114.0,7,0.99
632,Epic Liverpool Fights & Angry Moments,t3_gfpy25,https://www.youtube.com/watch?v=FI1UzxwqFSk,36,False,1588958748.0,16,0.8
633,TAA and Origi on instagram...no captions needed,t3_gfbebe,https://i.redd.it/fttzkcsprdx41.jpg,681,False,1588902489.0,22,0.99
634,Gift from Aleksander Čeferin. Signed with LFC players,t3_gfmn4t,https://i.redd.it/r1xc6gs92hx41.jpg,76,False,1588942361.0,4,0.93
635,Times flies!,t3_gffumg,https://i.redd.it/r21hcjk2xex41.jpg,203,False,1588916397.0,2,0.97
636,Free-talk Friday,t3_gfqg2v,https://www.reddit.com/r/LiverpoolFC/comments/gfqg2v/freetalk_friday/,17,False,1588961187.0,29,0.88
637,LFC Shirts: The Warrior Years #2 (2013/14),t3_gfmz3i,https://i.redd.it/711scezs6hx41.png,34,False,1588943901.0,16,0.93
638,Mohamed Salah - Overall 2019/20,t3_gfr131,https://youtu.be/TnTpQ0J-jwY,14,False,1588964042.0,2,0.75
639,"Roses are red, Two fast goals from Gini...",t3_gf2mgr,https://v.redd.it/rgtvdwfyxax41,1554,False,1588868569.0,26,0.99
640,How have we never seen this?,t3_gffgl2,https://v.redd.it/saqfaqv8tex41,134,False,1588915139.0,26,0.94
641,Andy Robertson 7 years ago !,t3_gfbf4d,https://i.redd.it/drzi3yxordx41.jpg,249,False,1588902557.0,18,0.99
642,One year ago.........,t3_gfcyv1,https://i.redd.it/22m0m0v46ex41.jpg,177,False,1588907338.0,1,0.98
643,Daily Discussion [2020-05-08],t3_gfodqf,https://www.reddit.com/r/LiverpoolFC/comments/gfodqf/daily_discussion_20200508/,16,False,1588950936.0,59,0.79
644,How do we replace Hendo?,t3_gfnwco,https://www.reddit.com/r/LiverpoolFC/comments/gfnwco/how_do_we_replace_hendo/,14,False,1588948508.0,40,0.71
645,One Year Ago - This Spine-chilling Rendition of You'll Never Walk Alone after the Match.,t3_gf58wq,https://v.redd.it/wprgr9b62cx41,461,False,1588881867.0,19,0.99
646,"PSA: If you play FIFA Ultimate Team and have your favourite team set as Liverpool, you will receive this beauty.",t3_gfajf6,https://i.redd.it/3c2z9lcyjdx41.png,182,False,1588899956.0,30,0.98
647,"A year ago today, a corner was taken quickly",t3_geuohc,https://v.redd.it/tel6ppwz58x41,5127,False,1588834828.0,247,0.98
648,Andy Robertson on Tomorrow's Episode of That Peter Crouch Podcast!,t3_gfe5z8,https://twitter.com/petercrouch/status/1258486642899378176?s=20,76,False,1588911056.0,5,0.95
649,"Trent’s gaming set up at home, what’s the need for the 3 TV’s?",t3_gfgkkm,https://i.redd.it/ml5lim954fx41.jpg,43,False,1588918776.0,17,0.86
650,"Merseyside is red, Mario's brother is named Luigi (O.C.)",t3_gfekm2,https://i.redd.it/hyxa9nrykex41.jpg,54,False,1588912327.0,3,0.88
651,FA would block any Premier League attempt to void season,t3_gfa4im,https://www.thetimes.co.uk/edition/sport/fa-would-block-premier-league-attempt-to-abandon-relegation-tcb5vztbh,108,False,1588898716.0,11,0.98
652,Liverpool 4-0 Barcelona: The Match of a Thousand Memes Recreated on FIFA,t3_gfiebe,https://www.youtube.com/watch?v=WUZI9ahi_vE,24,False,1588925157.0,3,0.89
653,"Your thoughts on the new Nike kit? I’m not exactly impressed. Lacks elegance. I loved the deeper red of the 18/19 kit. I would love to see it go even a deeper shade. Almost like a burgundy, red-wine red. Elegant and sexy. Why not?",t3_gge214,https://i.redd.it/wysnzkng8qx41.jpg,0,False,1589053404.0,18,0.21
654,"Melwood has partially reopened for LFC players to participate in individual, isolated running exercises. Obviously LFC squad are eager to get the go ahead for full return when safety permits.",t3_gf9bqq,https://twitter.com/_ChrisBascombe/status/1258426782602100738?s=20,92,False,1588896284.0,7,0.97
655,Gini's second goal with Anfield noise,t3_geyu1s,https://v.redd.it/zbt5c6m6g9x41,959,False,1588850241.0,90,0.99
656,Full uncut sequence of Gini's two goals vs. Barcelona with B/R commentary (3:55) - Streamable,t3_gf5l7o,https://streamable.com/j3cpx9,175,False,1588883245.0,47,0.98
657,Best goal commentary,t3_gfigl6,https://www.reddit.com/r/LiverpoolFC/comments/gfigl6/best_goal_commentary/,20,False,1588925393.0,45,0.8
658,"I'm Michael Reid, a Football Data Editor @OptaJoe and I have spent almost two years creating a complete database of every competitive Liverpool match in the club’s history. AMA!",t3_gf842b,https://www.reddit.com/r/LiverpoolFC/comments/gf842b/im_michael_reid_a_football_data_editor_optajoe/,68,False,1588892407.0,85,0.92
659,Barca reaction to 4-0,t3_gfcvqk,https://www.metro.co.uk/2020/05/07/how-lionel-messi-luiz-suarez-reacted-barcelonas-champions-league-collapse-liverpool-12666015,29,False,1588907077.0,11,0.9
660,Remembering Liverpool’s epic comeback vs Barcelona ESPNFC with Steve Nicol,t3_gfdd6p,https://youtu.be/7mYoUaMvJ3Q,27,False,1588908576.0,1,0.88
661,"Liverpool are interested in signing Werder Bremen midfielder Milot Rashica, who has a £33m release clause",t3_gf8ykt,https://www.mirror.co.uk/sport/football/news/president-confirms-liverpools-transfer-interest-21991093,48,False,1588895143.0,21,0.86
662,"Corner taken quickly, cool story",t3_gfheyi,https://www.reddit.com/r/LiverpoolFC/comments/gfheyi/corner_taken_quickly_cool_story/,12,False,1588921683.0,2,0.73
663,One year ago,t3_gf6m7q,https://www.youtube.com/watch?v=-nylBVzpySQ,69,False,1588887189.0,3,0.91
664,Mohamed Salah - Overall 2019/20,t3_gffk3w,https://www.youtube.com/watch?v=TnTpQ0J-jwY,16,False,1588915456.0,0,0.9
665,Premier League Weekend Warm up At Home Ep 5 – May 2020,t3_gfrhsl,https://www.youtube.com/watch?v=EnMsbfBa_ZM,0,False,1588966167.0,1,0.46
666,Corner taken quickly Origi audio - anyone know where I can find the full match radio commentary for Steve Hunter and Aldo?,t3_gff1dz,https://twitter.com/LFC/status/1258492550089973761?s=20,14,False,1588913794.0,1,0.85
667,When Crouch met Robbo,t3_gfd16r,https://youtu.be/32V0ROS5I4o,19,False,1588907544.0,5,0.86
668,Throwback Thursday: Inside Anfield Vs Barcelona,t3_gf2fx5,https://m.youtube.com/watch?v=Ik-DhHJM8eo,121,False,1588867610.0,5,0.99
669,"On this day 1 year ago, one of our greatest european nights ever. The picture speaks for itself",t3_geuo9u,https://i.redd.it/0rsh0uiy58x41.jpg,625,False,1588834807.0,22,0.99
670,Nice to see Mo enjoying the good weather,t3_gf29vj,https://imgur.com/fAmAHvE,112,False,1588866738.0,6,0.93
671,Well it's been a year lads! (Deleted it on accident),t3_gf260o,https://i.redd.it/suhxb0yprax41.jpg,99,False,1588866170.0,16,0.92
672,"As you guys have probably seen by now, it was 1 year ago sinc we beat Barcelona with 4-0 at Anfield, one of the best moments ever. This is my guitar cover of You'll Never Walk Alone, I did post the video like a month ago but just want to give some of the Liverpool feeling back to everyone! YNWA <3",t3_gfauj7,https://www.youtube.com/watch?v=L_ikbQb3KbE,15,False,1588900862.0,0,0.71
673,Robbo‘s Instagram is Boss,t3_gf3pjv,https://www.instagram.com/p/B_4dtVQhMHz/?igshid=1tem2ri7vy49f,42,False,1588874279.0,7,0.85
674,I didn’t even know this - still an insane stat and if i’m not mistaken that’s the same season Milner got the most assists ever in a cl season.,t3_gex9wc,https://i.redd.it/ka2gskx3y8x41.jpg,196,False,1588844113.0,15,0.98
675,Just remembering Curtis's banger !!,t3_gehas1,https://v.redd.it/9imith8jd4x41,3426,False,1588788807.0,98,0.98
676,A year ago today. Little POV snippet of the chaos at the final whistle.,t3_geynv7,https://v.redd.it/b2slmidyd9x41,132,False,1588849523.0,4,0.97
